comment,date,num_likes,tag,sentiment_score
지긋지긋하다 환경단체들 짓거리,2023.10.26,0,youtube,0
나도 그냥 종이컵이좋던데 식당컵에서 냄새남,2023.10.26,0,youtube,0
우리나라는 조상들이 무능했기에 땅이 조그마해서 플라스틱 많이 쓰면 그만큼 국토가 줄어든다 땅 작은 나라들은 알아서 플라스틱 소비를 금지하는 법안을 만들고 시행해야 한다 안 그러면 자기들만 손해다탄소배출 이런 건 UN의 외침하에 전세계적으로 하는 거지만 플라스틱 소비는 나라마다  자기들 실정에 맞춰서 알아서 하는 걸로 되어 있다,2023.10.26,0,youtube,0
종이컵은 반대고 종이빨대는 되고 하 환경부든 정부든 뭔가 이해안되는 사람들이 모여서 월급타가는것 같다,2023.10.26,0,youtube,0
이래봐야 다 소용없다 미국은 땅이 커서 분리수거도 안하고 땅에 묻고 다른나라들도 이렇게 까지 열심히 안함,2023.10.26,0,youtube,0
우산비닐관련 용품만들던 회사는 진짜 어찌하냐 우리나라가 환경을잘지켜도 옆나라들이 방사능버리지 플라스틱음식만들지 온갖더러운짓은 다하는데 불편하게 뭐하는짓이야 발전이아니라 퇴화하고있어,2023.10.26,2,youtube,0
이거 법 만든놈이 문재인인데 평산책방에서 일회용 처 쓰다가 과태로맞음,2023.10.26,0,youtube,0
다들 너무 편한것만 쫓으니 그렇지,2023.10.26,0,youtube,0
종이빨대는 만든놈이 누구냐 ㅈ같은데 진짜,2023.10.26,0,youtube,0
종이빨대 극혐플라스틱 빨대 가지고 다님 짜증남,2023.10.26,0,youtube,0
텀블러를 가지고 다니게 하던지 ㅋ,2023.10.26,0,youtube,0
환경부가 제대로 하는 일이 있긴 하냐툭 하면 뻘짓거리 개극혐,2023.10.26,0,youtube,0
코로나때보다 장사안된다더니 컵은 또 200개이상 나간다니 행복한고민이신듯,2023.10.26,2,youtube,0
환경단체들 어차피 환경이런거에 관심 ㅈ도없잖아전부 내가 하고싶은 취미생활 방해받기 싫거나 돈이 목적이더라,2023.10.26,0,youtube,0
세척하기 좋고 오래 쓸 수 있는 플라스틱 컵으로 사용하면 되죠 일회용 플라스틱 컵을 줄이자 라는 거죠,2023.10.26,1,youtube,0
우리나라 백날하면 뮤ㅜ해 옆나라오염수 배출은 아무말 못하면서,2023.10.26,0,youtube,0
식기세척기용 세제가 집에서 쓰는 퐁퐁이랑은 달라요 에구 종이컵은 그냥 쓰게 해주지 배달에 따라오는 쓰잘때기 없는 플라스틱용기나 좀 규제하시지,2023.10.26,0,youtube,0
이게 정부가 얼마나 멍청하냐면어느정도 대비책이랑 활로를 마련해주고 금지시켜야지금지니까 쓰면 니들 디질 줄 알아라이렇고 있는것임이게 조폭하고 뭐가 다르냐,2023.10.26,0,youtube,0
우리나라만 지구 지킴,2023.10.26,1,youtube,0
우산 비닐은 뭘로 대체함 저거 정말 기발한 발명품인데,2023.10.26,1,youtube,0
환경오염을 예방하려는 취지는 너무나도 좋지만 너무 느린감이있다 전부터 차근차근 규정해왔으면 종이빨대같은 대안보다 다른 대안이 나왔을지도 모르겠다,2023.10.26,0,youtube,0
물낭비 뒤지겠다그녕,2023.10.26,0,youtube,0
뒤에서 돈을 얼마나 받아쳐먹었을까,2023.10.26,0,youtube,0
한국에서 백날 규제하면 뭐하나 전세계가 다쓰는데 ㅋㅋㅋ 중국인도만해도 한국의 1000배는더쓰겟다 ㅋㅋㅋㅋ,2023.10.26,0,youtube,0
어쩔수없지ㅋㅋㅋㅋㅋ,2023.10.26,0,youtube,0
저렴한 유리컵 도입하고 ㅋㅋ 유리컵만큼 커피값 올리시고 리필 원할땐 바닥에 던지도록,2023.10.26,0,youtube,0
대통령실은 제외임 ㅋㅋㅋ 딱봐라 ㅋㅋㅋ,2023.10.26,0,youtube,0
진짜 탁상머리 행정 답없다 컵 제대로 닦겠냐  어후 이제 봉투 젓가락 컵 개인이 다들고다녀야되냐고 말이되는 제도를 운영해라  진짜 누가 아이디어 낸거야 사형시켜야함,2023.10.26,1,youtube,0
땅은 작은데 플라스틱 소비는 너무 많아서 묻을 땅이 없다는 건 이해는 한다 땅도 x만한 것들이 플라스틱은 왜 그리 많이 쓰냐 커다란 플라스틱에 담아주는 체인점커피는 왜 그리 많이 사쳐먹냐 쓰레기통에 버리지도 않아 길거리에 휙휙 버리고과거에는 이 정도로 플라스틱이 홍수는 아니었다플라스틱 묻을 땅 없어서 자기 동네에 묻으면 땅값 떨어진다고 난리칠 거면서,2023.10.26,0,youtube,0
계도기간에 왜 정착이 안되는지를 생각 해봐라,2023.10.26,0,youtube,0
일회용을 금지할게 아니라 재활용하는 기술을 개발하는 게 더 이득아니가ㅠ,2023.10.26,296,youtube,0
현실적으로비용이 몇배가 많이듬 그리고완전 깨끗한것만 재활용이 잘돼지 더럽고 지저분하면 잘안돼거나 안됨 분리수거 하는거보면 음식물 뭍어있는 일회용기 기대로 버리는거 엄청많음 개별단에서 분리수거가 잘안돼고 있음,2023.10.27,4,youtube,0
종이컵은  재활용ㅡㅡ안된답니다,2023.10.27,1,youtube,0
userxz4qh5rz2n안돼요 코팅돼서 그런가,2023.10.27,0,youtube,0
내말이,2023.10.28,0,youtube,0
종이컵은 액체 새지마라고 안쪽에 코팅해놔서 재활용이 어려운데 그나마도 종이컵끼리 한꺼번에 모아서 처리해야된다고 함재활용으로 내놓는다고 배달음식시켜먹곤 세척도 안하고 국물 묻은채로 플라스틱용기 그대로 내놓는데 그상태론 그냥 쓰레기임,2023.10.29,2,youtube,0
종이빨때 싯뻘름들아뻘짓하지말고 그거나 치워,2023.10.26,0,youtube,0
ㄹㅇ 미국만봐도 분리수거는커녕 음쓰까지 다같이버리는데 우리나라는 별에별거를다 재활용하느라 한세월임 그렇다고 실제로 재활용도안됨ㅋㅋㅋㅋㅋㅋㅋㅋㅋㅋㅋㅋㅋㅋㅋ,2023.10.26,1,youtube,0
돈 은 뭐 종이 로 만든것도 아니였나벼풀 뜯어만든 면섬유같은건 괜찮나봄나는 돈이 대충 면섬유 같은거로 만들어졌다고 생각 한다능정확히는 나도 모름,2023.10.26,0,youtube,0
다큐멘터리 lt씨스피라시gt2021는 해양쓰레기 중 56는 폐그물이라고 주장했다 반면 흔히 해양오염의 주범이라고 알려진 플라스틱 빨대는 해양쓰레기의 003에 불과하다고도 덧붙였다,2023.10.26,0,youtube,0
쓰레기가 해양쓰레기만 있는건 아니니까요,2023.10.26,1,youtube,0
우리 나라는 지한테 피해가 오면 잘못된 법지한테 득이 되면 잘한 법 ㅋㅋㅋ 걍 닥치고 일회용 쓰지마 ㅋㅋㅋ 니들이 말하는거 있지 미리미리 응 설거지 미리미리 하고 응ㅋㅋㅋㅋㅋㅋㅋㅋ,2023.10.26,1,youtube,0
이런식으로 흘러가서 결국  우리나라도 이제 식당에서 물을 사먹어야하는 시대가 오게될듯  물이 더이상 공짜가 아닌 시대가 곧 현실로,2023.10.26,0,youtube,0
과태료보다 일회용품에 세금을 물리고 재사용품을 쓸때 이득이되는 무언가 만들어서 사람들 인식을 바꾸는게 이득일듯갑자기 니들 쓰지마 이러니 반발이 나오고 대안이 안생기는거임,2023.10.26,0,youtube,0
기업한테 책임 지워야할 문제를 사용자에게 떠넘기는 어이없는,2023.10.26,0,youtube,0
국밥집에 점심200명에 9000원만잡아도 점심매출만180만원이구만 죽는소리오지네가게파시고 놀면되겠구만,2023.10.26,0,youtube,0
웃기네컵 뚜껑이 문제가 아니라 그냥 습관적으로 사람들은 빨대를 쓰는데뭔소리고환경단체가 암적 존재다돈필요하면 기업들 찾아가서 시비걸고 정부찾아가서  환경이니 헛소리하고지구 온난화 말하지 말고 너희들이나 커피 먹지 마라,2023.10.26,0,youtube,0
징징거리는거 다 들어주면 일을 어떻게 추진함,2023.10.26,1,youtube,0
비닐만드는공장에서 일하던 한명으로써 생분해 비닐을 만들수 있습니다 다만 라인설비 교체와 원료교체를 해야하고 중소기업들은 자금난에 힘들겠죠 이런걸 정부가 지원하여 금액을 낮춰서 소비자들에게 지금 플라스틱 가격에 납품할수 있다면 얼마나 좋겠습니까 중소기업 일회용품 만드는 회사들과 자영업자들 다죽이는 정책입니다,2023.10.26,2,youtube,0
환경보호단체가 얼마나 쓸모 없냐면 원래 일회용품 식기류는 종이였음 환경 오염 이유로 플라스틱으로 바꿈이제는 다시 환경 오염 핑계대며 종이로 바꿈종이환경 오염gt플라스틱환경 오염gt종이 무한반복임 ㅋㅋㅋㅋㅋ 어느 장단에 맞춰야하고 얘네는 먼 힘이 이리 쎄길래 전 세계가 따라주냐 진짜,2023.10.26,0,youtube,0
윤재앙,2023.10.26,0,youtube,0
생분해성  친환경자제 아니면 무조건금지가 맞다쓰레기가 넘쳐 미관 환경 골치거리인데그걸 빨리 못끊으면 악순환과 돌이킬 수 없다,2023.10.26,0,youtube,0
걍 입대고 마시면되지 굳이 빨대가 필수임,2023.10.26,1,youtube,0
과태료받을려고   더러운법만만드는구나   나라꼬라지  웃긴다,2023.10.26,0,youtube,0
종이컵은 않되고 플라스틱 컵은 되냐 플라스틱에도 환경호르몬 나오는데빨대도 플라스틱인데 빨대는 않되고무슨 정책이 지 맘대로냐,2023.10.26,0,youtube,0
누가 컵을 손으로 다씼나요 드럽고 위생적이지 않으니 식기세척기를 사세요 그정도 투자는 해야죠,2023.10.26,1,youtube,0
즈스들 돈만 처생각하고,2023.10.26,0,youtube,0
바다속 그물이나 걷어라,2023.10.26,0,youtube,0
종이빨대는 되고  종이컵은 안되고,2023.10.26,0,youtube,0
봉투 돈 받아도 뭐라하고 머리 아프네그리고 인건비 때문에 식당서는 설거지 쓸 바에 컵 사서 버리는게 싸니까종이 빨대는 맛을 건드리는게 문제지환경 단체 보면 필요 없는 단체 같음,2023.10.26,0,youtube,0
근데 종이봉투도 환경오염 아닌가 종이봉투 재활용 안하고 버리게 되던데,2023.10.26,0,youtube,0
미쳤다1회용컵이 그렇게 환경문제인가  그냥 사람들을 다 없애라,2023.10.26,0,youtube,0
매장에서쓰는 일회요컵과 일회용 도시락도 너무 많이 사용하니 이것부터 강화해라,2023.10.26,0,youtube,0
사실 종이컵 빨대 이런거 다 미세플라스틱 섭취의 주범임  성인평균 한달에 신용카드 1장정도의 플라스틱을 섭취한다고 함 뜨거운 음표는 정말 플라스틱 녹여서 마시는거랑 비슷하니 매일 드시는분은 머그컵 가져가서 드세요,2023.10.26,0,youtube,0
a hrefhttpswwwyoutubecomwatchvfIlIP7aWMxkampt3m27s327a 선생님 그거 기울여서 입대고 마시면 가끔 컵 뚜껑 벗겨져서 내용물 다 쏟겨요 ㅋㅋㅋ 뭘 대안인것처럼 말씀하시네 ㅋㅋ,2023.10.26,1,youtube,0
설거지 알바 일자리 생기겠다 ,2023.10.26,0,youtube,0
자영업자들아  니들이 편하게 돈벌고 인력안쓰고 더 이익을 챙기려니까 환경은 더 나빠진다 외국은 일회용품 없어진지 10년이 돼간다 벌금도 우리나라에 10배이상인대 자영업자들은 언제까지 니들 돈드러가고 쉽게 벌려고 하지마라 양심없는 식당들,2023.10.26,0,youtube,0
우산봉투 없으면 물질질 흘리고다녀서 누구하난 머리깨질텐데 넘 위험하지않나,2023.10.26,1,youtube,0
일뱌 사무실 회사에서누 써도 되는건가요,2023.10.26,0,youtube,0
중소기업은 곡소리 나겠네,2023.10.26,0,youtube,0
이게다 좌파환경단체 문재앙때문임,2023.10.26,0,youtube,0
난 그래서 스테인리스빨대를 들고다니지 크크,2023.10.26,0,youtube,0
도대체 이 코딱지만한 나라에서 왜 이런일들을 벌이는거지 중국이나 시켜라,2023.10.26,0,youtube,0
이딴거 말고 해양쓰레기를 단속해라 정부는 왜 가장 심각한 해양쓰레기는 외면하고 헛짓거리만 하냐,2023.10.26,0,youtube,0
ㅋㅋㅋ결국 큰틀이 있었구만환경은 핑계고 나라에 돈이 없으니 종이를 사용하면 인권비 보다 훨씬 저렴하니 설거지 인력을 구하면 국민연금 세금을 걷어 드릴 수 있으니 규제 한거구만,2023.10.26,0,youtube,0
물가를 끌어올리겄는디,2023.10.26,0,youtube,0
그렇게 환경 생각해서 규제 할거면 과대포장도 좀 어떻게 안 되나요 그것도 다 비닐이고 플라스틱인데,2023.10.26,0,youtube,0
지자체에서 종이컵을사용하면 부서원 전체를 감봉시키자,2023.10.26,0,youtube,0
스타벅스처럼 빨대 금방 이상해짐 녹녹,2023.10.26,1,youtube,0
ㅋㅋㅋㅋㅋㅋㅋㅋ응 쓸거야,2023.10.26,0,youtube,0
수산업 어구 실명제나 시행해야됩니다 환경단체들이 수산업 못건드리는이유가 자기들한테 기부금을 엄청많이 주니까 어구쓰레기 눈감아주고 그걸 일회용품 플라스틱이 바다에 미세플라스틱 증가시킨다고 언론플레이 하는건데 솔직히 어구쓰레기가 해양환경오염의 주범입니다 소상공인들  죽이는 법 만들지말고 어구실명제 최대한 빨리도입하는게 환경오염 줄이는 지름길입니다,2023.10.26,0,youtube,0
플라스틱도 제재를 할 꺼면 정신적으로 악영향 끼치고 사회성 결여 시키는  유튜브 sns도 제재 좀 해라,2023.10.26,0,youtube,0
그동안 편하게 살았잔어 환경지키면 남좋은건가 다본인들 좋은거잔아,2023.10.26,0,youtube,0
200개 ㅎㄷㄷㄷㄷ 돈을 많이 버는구나,2023.10.26,0,youtube,0
종이로  된건 좀  봐주고  플라스틱이나  줄여봐,2023.10.26,0,youtube,0
당연히 환경 보호해야지요당연히 플라스틱 줄야여지요그런데 빨대나 종이컵은 환경에미치는 영향이 01퍼센트도 안됩니다그럼에도 불구하고 최대한 줄여야지요그런 문화와 시민의식이 결국 예산책정에 영향을 미치는 것이고 환경개선을 위한 과학 기술 개발 등에 예산이 투입되어 효과적으로 환경을 보호할 수 있는겁니다 시민의식과 문화는 정책을 통해 강제로 만드는 것이 아닙니다 정부가 고작 빨대나 종이컵이나 규제하고있고 전형적인 탁상행정이네요할일이 그렇게없나요,2023.10.26,0,youtube,0
그냥 마셔 이것들아  종이컵이 더급해보이는구만,2023.10.26,0,youtube,0
컵 닦는데 쓰는 세제는 환경오혐 아니냐,2023.10.26,1,youtube,0
환경 생각하면 전기차 충전소나 더 늘려라진짜 힘없는 사람들만 때리고 있네국회가 무슨 강약약강 찌질의 표본이여,2023.10.26,0,youtube,0
배달 포장이 더심각하다고 ㅎㅎ 테크아웃은,2023.10.26,0,youtube,0
주변에 종이컵 물컵으로 주는곳은 못봤는데 서울은 종이컵 주시나보네요,2023.10.26,0,youtube,0
식세기 사용하면 안되나요,2023.10.26,0,youtube,0
정신치려라 인간들아 언제까지 풍요가 계속될것 같냐 신자유주의가 말하는 무한성장 지구라는거 자체가 한정된 공간인데 말이 되냐 지금 우리가 누리는 편의는 애초부터 지속될 수가 없는거였다 언젠간 끝날 수밖에 없는거였다고 쓰레기는 무한으로 늘어가는데 지구는 한정되어있다 플라스틱 최소 예상치가 500년은 지나야 썩는데 어디다 묻을건데 바다 그거 다 자외선에 갈려서 미세플라스틱되면 그거 먹은 생선 우리가 다시 먹는거다,2023.10.26,0,youtube,0
  개돼지들이 왜 편리하려고함,2023.10.26,0,youtube,0
식당에 물을 주지말아요 물을 파세요 ㅎㅎㅎ 그러면 됩니다생수 300미리 가져다 주고 파세요,2023.10.26,0,youtube,0
수도세는 국가가 지원하나,2023.10.26,0,youtube,0
탁상공론 오지다 멍청한 공무원들,2023.10.26,0,youtube,0
기어이 정부가 삥을 뜻을듯300만원이 벌금이야자영업자들은 봉이야,2023.10.26,0,youtube,0
이거 빨리 안하면 계속 미루게 된다 부담되더라도 어차피 가야만 하는 길이다 카페 사장들 준비나 단단히 하시라,2023.10.26,0,youtube,0
식당알바 일주일도 해본 적 없는것들이 규제 만드니까 이지랄이지,2023.10.26,0,youtube,0
그동안 너무 편하게 살았지,2023.10.26,0,youtube,0
아니 언제까지 연장할꺼야 맨날 불편하다고 하면 계속 연장 할꺼야,2023.10.26,0,youtube,0
문크예거는 일회용품 안쓸까,2023.10.26,0,youtube,0
이따위로 할거면 텀블러 사용 안하면 음료 제공 안된다해 ㄷㅅ들아,2023.10.26,0,youtube,0
물값 인상예정   입니다    전기가스 수도  세제회사  주식오를예정 입니다,2023.10.26,1,youtube,0
식기세척기 구비 필수,2023.10.26,0,youtube,0
국회에서도 다회용 컵 쓰시는 거죠,2023.10.26,0,youtube,0
팩트 종이컵 시절보다 설거지하면서 나오는 오염된 물이 환경을 더 망침  저렇게 사람 몰려오는 시간대에는 컵을 똑바로 씻을 리가 없음 위생적으로 별로  퐁퐁이 완전히 씻겨지지 않은 상태로 컵이 나옴위장파괴 ㅈㅈ,2023.10.26,1,youtube,0
일회용을줄이긴해야지 한국은 너무낭비가심하다 능력안되면 자영업하지말아야지,2023.10.26,0,youtube,0
일회용품 편리해 설거지 귀찮으니까 대충 쓰고 버리니까 얼마나 편해 그래서 집에 그릇이랑 수저가 없다,2023.10.26,0,youtube,0
배달은 어떻게 되는 겁니까,2023.10.26,0,youtube,0
가만히 보면 우리나라만 열시미 지키는듯 해외 나가보면 ㅋㅋㅋㅋ,2023.10.26,1,youtube,0
대중식당에는 종이컵이 우선이지 위생을 생각좀히랴,2023.10.26,0,youtube,0
저딴걸로 서민들 괴롭히지말고 국내기업들 과대포장이나 똑바로 단속해라 무슨 과자가 봉지는 큰데 양은 쥐좆만하고 ㅋㅋ,2023.10.26,1,youtube,0
지구의 미래를 위해서 좀 불편한것도 참을줄 알아야지 예정대로 사용금지해라,2023.10.26,0,youtube,0
불편하긴 해도 하는 게 맞긴 한듯,2023.10.26,0,youtube,0
환경 생각 한다는 것들이 화장은 왜 하고 다니는지일찍 나와서 걸어,2023.10.26,0,youtube,0
불편하겠지만 일회용 플라스틱 종이컵은 줄일필요가 있다  그만큼 환경문제가 심각하다는거다,2023.10.26,0,youtube,0
쥐좆만한 나라에서 지구 환경보호 하겠다고 설쳐봤자 중국같은 나라가 있는 이상 아무짝에도 쓸모없는 짓거리임,2023.10.26,1,youtube,0
식당 종이컵은 솔찍히 그걸 다 버린다고 생각하니 쓰기 불편함 컵 세척기쓰나 종이컵쓰나 장기적으로 쓰면 그게 그거일텐데 굳이 환경파괴되게 종이컵,2023.10.26,0,youtube,0
내 컵 내 밥그릇 내 수저 다 들고 다닙시다가장 좋은 방법은 손으로 먹는건가요 세제도 사용하지 말고 화장지도 쓰지말고 기저귀도 쓰지말고 음음 할일이 많아져서 일자리 창출에 도움이  아주 도움이 될법합니다,2023.10.26,0,youtube,0
이럴거면 농촌에서 밭에깐는 비닐도 못쓰게하겄네 우리만 지키면 뭐하냐고,2023.10.26,0,youtube,0
옛날엔 우째했노,2023.10.26,0,youtube,0
뷔페는 음료 종류가 많은데 그건 어쩌나ㅋㅋ,2023.10.26,0,youtube,0
그냥 개인 텀블러 들고 다니자,2023.10.26,0,youtube,0
결국은 과소비문젠데 그걸 줄이려는 정책으로 가야하는거아닌가종이많이써서 비닐썼지않나,2023.10.26,0,youtube,0
환경단체 애들은 옷도 입고 다니지 말아라,2023.10.26,0,youtube,0
꼬우면 장사접어 ㅋㅋ,2023.10.26,0,youtube,0
진짜 쓸데없는짓,2023.10.26,0,youtube,0
기업들 과대포장부터 막아야 하는거 아님 그게 더 효과적이겠다ㅋㅋ,2023.10.26,0,youtube,0
국회의원 월급 줄이는 행정은죽어도 안하네,2023.10.26,0,youtube,0
그냥 개인 텀블러 가지고 다니자,2023.10.26,0,youtube,0
거 좀 설거지좀 하면되지,2023.10.26,0,youtube,0
코로나 전에는 어떻게 장사했냐,2023.10.26,0,youtube,0
왜난 좋은데 다들 내말잘들어 이런거 막지만말고 그대로납둬봐 무슨일이 벌어지나 안그래도 ㅈ같은 국가가 더 ㅈ같은국가가될걸 그러다보면 결국 전쟁이지 ㅋ,2023.10.26,0,youtube,0
종이빨대는 환경 오염 아니야 ㅋㅋㅋㅋㅋ,2023.10.26,0,youtube,0
환경단체는 배민도 안하는거겠지,2023.10.26,0,youtube,0
아니 종이도 재활용 안되면서 종이 쓰라는건 뭐냐,2023.10.26,0,youtube,0
일회용포장은 어쩔건데,2023.10.26,0,youtube,0
대책은없는 병신정부,2023.10.26,0,youtube,0
전 세계적으로 제일 쓸데없는 짓거리가 환경 운운 하면서 다른걸로는 환경 아작내는 중 ㅋㅋㅋ 작게 아껴서 크게 박살내는데 뭔 환경보호 ㅋㅋㅋ,2023.10.26,0,youtube,0
직원을 더 고용해야죠,2023.10.26,0,youtube,0
솔직히 빨대는 안만들어도 되는거 아님 애기들 요구르트 정도만 빼고 그리고 컵은 본인 텀블러 따로 들고다니면 바로 해결됨 이런거 홍보좀 시켜,2023.10.26,0,youtube,0
편하게 돈 벌려고,2023.10.26,0,youtube,0
소비자와 자영업자만 불편하게 하고 제품의 말도 안되는  과대 포장은 일도 규제 안하는 기업 친화 정부,2023.10.26,0,youtube,0
식기  세척기 쓰면되지  살균까지 다  해  주는데,2023.10.26,0,youtube,0
일회용품 처리방법을 생각하는 게 좋은거지 초등학생들이 앉아있나,2023.10.26,0,youtube,0
종이빨대 정도는 좀 참자 아님 빨대 쓰지 말자,2023.10.26,0,youtube,0
나도 장사한적은 없지만 진짜 식당이나 카페 못해먹을것 같다,2023.10.26,59,youtube,0
전세계 개나소나 자영업 1위나라취업고고,2023.10.26,1,youtube,0
취업일자리는 있고,2023.10.27,1,youtube,0
userhn9ge5re5c 취업할 능력 없는건 아니고,2023.10.27,0,youtube,0
종이컵 뿐만 아니라 1회용 용기 환경오염 심각합니다 식당 허리 아프면 접어야지요,2023.10.26,0,youtube,0
저거 시행했던 문재앙도 자기 카페에서 일회용품 사용했는데 이게 실효성 있다 생각하냐 ㅋㅋ,2023.10.26,1,youtube,0
식당에서 진짜 종이컵 싫어요ᆢㅠ연장해도 똑같아요 ㅠㅠ 그때가도 마찬가지예요ᆢ 장바구니 가지고다니고 텀블러가지고 다니기로해요환경운동에 적극 노력해야해요ㅠㅠ 당장의편리를 위해  불편해도 지금 노력해야 후세가 살수있답니다,2023.10.26,3,youtube,0
후세 걱정 ㅋㅋ 어차피 저출산으로 머지않아 소멸될 나라임,2023.10.26,3,youtube,0
ㅋㅋ텀블러는 만들때 환경오염안되냐ㅋㅋ 200번은넘게써야는데ㅋㅋ,2023.10.26,2,youtube,0
userjo8qf2qn2f텀블러 실제로 50회정도 사용하면 그때부터 환경오염 없어지는거랑 같습니다,2023.10.26,1,youtube,0
zhhhqhg761d 뭔소리입니까 220번은 써야된다고 버젓이 연구결과가있는데ㅋㅋㅋ,2023.10.26,1,youtube,0
zhhhqhg761d 님이말한건 폴리프로필렌 텀블러겠지만ㅋㅋ보통 냉보온때문에 스테인레스텀블러를많이쓰는데 스테인레스텀블러는 220번은써야 환경오염에 도움됩니다ㅋㅋ,2023.10.26,1,youtube,0
환경단체 진짜 단체로 죽여버리고싶다 ㅋㅋ,2023.10.26,0,youtube,0
200명오면 200명에대한 알바를써라 돈은벌고싶고 돈쓰긴싫다 자영업자들 보면 배부른소리만함,2023.10.26,0,youtube,0
플라스틱 분해되는 기술을 개발하라고 그사람 재벌될듯,2023.10.26,0,youtube,0
다회용컵 ㅋㅋ 전부 수거해서 최저 시급에 절반도 못받는 자활근로자들에게 세척을 지시 하고 있지요,2023.10.26,0,youtube,0
종이컵과 빨대는 정말 갑자기 바뀌면 힘들것같은데요  식당테이블에 까는 비닐은 정말 없어져도 괜찮은듯요,2023.10.26,11,youtube,0
게장집이나 생선 기름같은 걸 방지하고 냄새 덜나게 하려면 식탁비닐도 필요해요ㅠㅠ,2023.10.26,3,youtube,0
애를쓰네 써 그냥 인간멸종되면 해결되는걸,2023.10.26,0,youtube,0
종이빨대는되고 종이컵은 안되나,2023.10.26,0,youtube,0
진짜 문제일으키는놈들 따로규제받는 사람 따로,2023.10.26,20,youtube,0
제대로  청소할지,2023.10.26,0,youtube,0
공무원 너희들이 설거지해라,2023.10.26,0,youtube,0
생산 공장은 어떻게 되는건데,2023.10.26,0,youtube,0
종이 빨대 좀 없애자,2023.10.26,0,youtube,0
우산비닐은 매장내 물 실시간 청소 넘어짐 보상 등등,2023.10.26,1,youtube,0
숏컷기집은 ㄹㅇ 과학이네,2023.10.26,1,youtube,0
ㄹㅇ 과학입니다 그냥 짐승이라고 보면됩니다,2023.10.26,1,youtube,0
usernm8pn6jj4m 사실상 지들이 사라지는게 환경에 더 도움되는데 ㅋㅋ 쟤네만 모름 ,2023.10.26,0,youtube,0
글쎄 안쓰면  좋은데환경을 생각해서먼 미래에도 일회용품이 없을까 그대로 쓰고 있을거 같은데재활용 방법을 생각 해야할듯그게 제일 안피곤할거 같은생각,2023.10.26,0,youtube,0
그냥 좀 편하게 좀 살자,2023.10.26,0,youtube,0
종이빨대는 비닐코팅때문에 일반쓰레기임 플라스틱빨대는 제활용이라도 되지,2023.10.26,0,youtube,0
자원순환팀장아 넌 평생 일회용품 쓰지마라,2023.10.26,0,youtube,0
