comment,date,num_likes,tag,sentiment_score
1년이 아니고 2년입니다  문제는  각종 단체 개인이  의견도 내고 대안도 건의하고  형평성문재도 제기하고 많은걸했는대 환경부는  2년간 계도기간이다 라며  1년이 한번  a4종이 두장 보내고 끝입니다 아무런 변화 없이요 자구책으로 종이빨대는 된다해서  두배에서 열배더 비싼 종이빨대로 바꿨는대 더웃긴이야기는  재활용센터에서 종이빨대  안받아줌니다   패지수거아주머니들 처음애는 가저가더니 나중에는  안가져갑니다 재활용잘안된다고 분류바용이더들어서  센터에서 안방아준다네요 구청스레기수거팀은 재활용쓰래기 가져갈때  수거해가는대  물어보니  다소각이랍니다 이개 무슨 개그 프로도아니고,2023.11.1,0,youtube,0
일회용품 두번쓸게 그냥쓰게놔둬 ㅂㅅ들아 ㅈ같은법쳐만들고있네,2023.10.31,0,youtube,0
번복할거면 법만든놈 자르고시작해라,2023.10.31,0,youtube,0
아니 환경단체가 뭔데 ㅋㅋ 진짜 정신나간 인간들,2023.10.31,0,youtube,0
최저임금 낮춰서 컵접시닦는사람이라도 고용하게 만들어주던가 젠장 이놈의 나라는 1인 혼자서 그많은 음식준비를 하게만들어,2023.10.31,2,youtube,0
개 떡같은 법이네밥도 처먹지마라환경단체 그렇게 잘지키면마트 일회용 사지마라모든게 일회용 아닌가,2023.10.31,0,youtube,0
개정부 대체재는 만들었지,2023.10.31,0,youtube,0
윤병준 더불어민주당 의원 외 12인은 지난 6일 자원의 절약과 재활용촉진에 관한 법률 일부개정법률안을 공동 발의했다 이들은 기존의 일회용품 규제에서 더 나아가 불가피하게 사용되는 일회용품 재활용을 용이하게 이루어질 수 있도록 하고 생산단계부터 발생량을 줄이도록 할 필요가 있다며 법안 발의 이유를 밝혔다,2023.11.3,0,youtube,0
어릴적 중국집처럼 그릇 회수해가는거 부활하나,2023.10.31,0,youtube,0
진짜 국회의원들ㅋㅋ대기업들 과자나 생필품화장품 등에 사용하는 플라스틱만 없애도 온나라가 깨끗해 지겠네,2023.10.31,2,youtube,0
우유팩마냥 종이팩도 육안으로 깨끗하면 수거해서 재활용이 된다는데 수거업체선정이 어려운거가요,2023.10.31,0,youtube,0
이젠 가정서도 일회용품 못 쓰게 하겠네,2023.10.31,0,youtube,0
저도 가계에서 손님들 응대할때 커피나 차 종이컵인데 저야 바꾸는게 별문제 아닌데다른업종분들은 머리좀 아프겠네요,2023.10.31,0,youtube,0
플라스틱 빨대는 종이로 바꾸면서 종이컵은 또 왜 플라스틱으로 바꿈ㅋㅋ,2023.10.31,0,youtube,0
오 천재인듯,2023.11.6,0,youtube,0
카페도 사람이 순환이 아니고 짱박혀있어서 다용도 컵도 모잘라요 사려고 해도 너무 비싸고 순환이 안되니 컵은 없는데 주문은 자꾸하지 방법이 없어요,2023.10.31,0,youtube,0
a hrefhttpswwwyoutubecomwatchvkSpgCX_6OhQampt1m40s140a 그 운동가처럼 생겻네,2023.10.31,0,youtube,0
아니배달음식은어케되는거냐고ㅡㅡ 샹,2023.10.31,0,youtube,0
관공서 종이컵도못쓰게 해주세요,2023.10.31,0,youtube,0
세척한 것이라해도 위생을 못믿겠는데,2023.10.30,1,youtube,0
개인용 컵을 케이스에 넣고 다녀야하나 으,2023.10.30,0,youtube,0
개인 물컵 들고 다녀야 겠습니다,2023.10.30,1,youtube,0
좀  유연하게  하지,2023.10.30,0,youtube,0
과대포장도 금지하자,2023.10.30,0,youtube,0
진짜 잘됬네요 환경문제 너무 심각해요 불편해도 저렇게 안하면 진짜 답안나오는날 옵니다 미래 아이들 위해서라도 불편해도 잘하는거에요 ㅠㅠ,2023.10.30,2,youtube,0
재앙이때 만든건데 ㅋㅋ,2023.10.31,1,youtube,0
윤병준 더불어민주당 의원 외 12인은 지난 6일 자원의 절약과 재활용촉진에 관한 법률 일부개정법률안을 공동 발의했다 이들은 기존의 일회용품 규제에서 더 나아가 불가피하게 사용되는 일회용품 재활용을 용이하게 이루어질 수 있도록 하고 생산단계부터 발생량을 줄이도록 할 필요가 있다며 법안 발의 이유를 밝혔다,2023.11.3,0,youtube,0
배달은 제외입니다,2023.11.6,0,youtube,0
이거 규제 만든 사람 이쑤시개 하나 종이컵 하나 쓰는날엔 이빨 다 뽑아버린다,2023.10.30,0,youtube,0
계도기간에 준비나 대비 따윈  개나 줘버려놓고  계도기간에 대한 인식이 부족해,2023.10.30,0,youtube,0
하진짜 환경오염이 어디서 일어나는지 모르나,2023.10.30,3,youtube,0
무조건 쓰지말라고만 하는게 맞는거냐,2023.10.30,2,youtube,0
종이컵은 왜 프라스틱재질 비닐재질 이문제아님,2023.10.30,0,youtube,0
아니 기업에서 재활용 가능한 플라스틱이나 종이를 만들게 법적으로 제도를 마련하는게 먼저 아님 기업에서 계속 일회용을 만들어 내는데 이걸 가게에서 안 쓴다고 안 만들겠음,2023.10.30,0,youtube,0
쿠팡 부터 못쓰게하세요 엄청납니다,2023.10.30,7,youtube,0
요즘 스타버스같이 소비자가 을인 메이커 말고 남이 쓰던 컵주면 누가 마시려고  할까플라스틱 컵 청소하는것도 힘든데 대안을 주고해라,2023.10.30,0,youtube,0
설거지로 인한 물낭비 바다오염 토양오염에 큰 역할을 하겠네 ㅋㅋㅋ 진짜 어떤 정치인 머리에서 나온 거냐,2023.10.30,0,youtube,0
전국민 개인 텀블러 하나씩은 줘야지  라는 헛소릴  찌끄려본다,2023.10.30,0,youtube,0
장례식장에서는 어찌되나요,2023.10.30,0,youtube,0
대기업과자 과대포장먼저 건드려야지자영업자만 건드려대니,2023.10.30,1,youtube,0
종이컵은 플라스틱이 아닌데두 못쓰나요ㅡㅜ,2023.10.30,0,youtube,0
현실성이 없는 환경규제환경부에서 일회용품을 사용하면 누가 혼쭐내나,2023.10.30,2,youtube,0
컵이나 스텐컵쓰면되는데제발 좀 닦자어제쓴거 물로대충닦아서욕하는게아니고컵안에 희멀건 물때보면물맛뚝떨어짐,2023.10.30,0,youtube,0
일회용기도 친환경인데 왜 친환경만든다고 세금 들이붓더니 ㅋㅋ,2023.10.30,0,youtube,0
종이빨대 싫은데ㅡㅡㅡㅡ,2023.10.30,0,youtube,0
이건모 돈을주고 하지말라고 하던거 이건모 쥐뿔 주지도않고 그냥 하지말래 산적이여뭐여,2023.10.30,0,youtube,0
i생수 음료수 야쿠르트 이런것도 해야되는거 아닌가i반찬그릇 뚜껑도 싹다 해야지 ㅋㅋㅋㅋㅋㅋㅋㅋㅋㅋㅋ 민주당이 했을꺼 같네수출은 몰라도 수입물품에 플라스틱은 받지말어라 ㅋㅋㅋ,2023.10.30,0,youtube,0
그냥 생분해 재질은 허용하면 그나마 나을것 같은데 왜 인정 안해주지,2023.10.30,0,youtube,0
우리나라에서 하면 뮈라나 티도 안나 미국하고 중국에서 버리는게 80프로임,2023.10.30,0,youtube,0
여론조사는 87퍼가 일회용규제찬성인데정작 손님들은 종이컵을찾던데이중인격인가,2023.10.30,1,youtube,0
대안을 조금이라도 마련해놓고 정책나오는건 환영인데 그냥 계도기간 주고 하지말라고 하는 떼법 클라스보소 저 비닐업체 사장님은 날벼락 맞으셨구만,2023.10.30,14,youtube,0
설거지 덜 된 것 보단 미세플라스틱이라도 종이컵이 더 나을 것 같은데ㅠ,2023.10.30,1,youtube,0
환경단체는 나서지마라니네들은 환경좀비잖아,2023.10.30,1,youtube,0
잠깐 편하자고 점진적으로 지구멸망 시킬 필요는없자나,2023.10.30,0,youtube,0
일회용품 규제 여자가 만들었다 100,2023.10.30,1,youtube,0
위생상종이컵은 써야 된다다른 사람이 먹던물컵 설거지 않하고 다시 나올수 있씀작은식당들은 설거지 인건 비도 안나옴진짜 규제는 택배회사 포장,2023.10.29,0,youtube,0
이나라는 자영업자걱정 절대안해준다,2023.10.29,13,youtube,0
도시락도 두세개 번갈아 가면서 써요 응고 밥 반찬 물통 수저 숫가락 샐러드 도시락 쉬워요 냉장고에 있는것  예를 들면 채소 ㅇㅇ하고 섞어서 기름장  샐러드우 고추장 비비고 볶아서 계란 후라이 하고 계란 부서서 비벼서 두부 소세지 소고기 돼지고기 바나나도 과일도 다 됩니다 오이도 가지익혀서 뜨거운 물에 데쳐서 양념장 넣고 드세요 따로 따로 이렇게 그긋에 표시해서 넣고 같이 먹어요  그것이 돈 안들어요 또 친구랑 나눠 먹어도 되고 영양도 되고요 아시겠어요 풍성해 보이고 좋아요 상추도 그외에도 된다포만감 온다 주라 신이하시는일  아멘밥도 떡국 만두도 다됩니다  소스도  밥 잘 넘어간다 식후에 차도 먹고 돈 안 들어요 제가 그렇게 먹어요,2023.10.29,0,youtube,0
한국 주은 총 있어서 지구 지키고 사랑하고 선한일로 하면 신이 해 주셔요 그것이 신 은총이다 방향궤도 전환해요 싸우는것 사람 다쳐서 안됩니다,2023.10.29,0,youtube,0
스텐 도시락 스텐 물통 수저  젓가락  이렇게 네모난 직사각형 밤찬 밥 물통 옆에 수저 젖가락 넣는것 있고  신이하시는일,2023.10.29,1,youtube,0
탁상공론,2023.10.29,0,youtube,0
뚜껑있는 내 컵 들고 다니는게 최고,2023.10.29,1,youtube,0
지금 자영업자들 힘든데 재활용까지 진심 자영업자 죽이기인가,2023.10.29,1,youtube,0
없던시절에 태어난사람이 얼마나 된다고 ㅋㅋ,2023.10.30,0,youtube,0
다같이 원시인으로 돌아가죠 그럼 ㅋ,2023.10.30,0,youtube,0
인권비 말고 인건비입니다ㅋㅋ ㅋ,2023.10.31,0,youtube,0
hant 출근은 무슨 그냥 산에가서 맨몸으로 누워 있어야죠 움직이면 다 소비인데 ㅎㅎㅎㅎㅎㅎㅎㅎㅎㅎㅎㅎㅎㅎ,2023.11.1,0,youtube,0
편하자고 만든것을 왜 없앨려고 하는건지 진짜 노이해,2023.10.28,1,youtube,0
결국 해결방안100퍼 본인부담 본인이 해결방안 생각은 해야겠다만 이것도 안돼 저것도 안돼 할거면 방안을 제시해줘라 환경문제심각한건 알겠는데윗분들 지들끼리 싸우면서 1도 도움도 안됨넘들 언제까지 싸우기만하니,2023.10.28,0,youtube,0
자영업자 또 돈달라고 징징 되겠네 힘들어 죽겠다고 안봐도 비디오다,2023.10.27,1,youtube,0
비닐 봉투를 종이 봉투로 바꾸면서ㅋㅋ종이 컵은 왜 안되는거야 ㅋㅋ,2023.10.27,3,youtube,0
와 난 식당에서 종이컵 주는데를 못봤는데 의외로 많았었구나,2023.10.27,0,youtube,0
이런거말고 길거리 흡연 담배꽁초나 규제좀하지,2023.10.27,4,youtube,0
식당에서 밥먹고 믹스커피로 입가심은 어케함 종이컵 못쓰면 컵설거지 답이없는대 이게 형평성이 없어  현장에서 보고 판단을 해야하는대 그냥 탁상 머리에서만  하고있으니,2023.10.27,3,youtube,0
하루만 나와서 설것이 해보면 답나옴 사람스구하기도 힘들고,2023.10.27,1,youtube,0
윤병준 더불어민주당 의원 외 12인은 지난 6일 자원의 절약과 재활용촉진에 관한 법률 일부개정법률안을 공동 발의했다 이들은 기존의 일회용품 규제에서 더 나아가 불가피하게 사용되는 일회용품 재활용을 용이하게 이루어질 수 있도록 하고 생산단계부터 발생량을 줄이도록 할 필요가 있다며 법안 발의 이유를 밝혔다,2023.11.3,0,youtube,0
아저씨 문재인이 만든 법이라는데 한마디 해주시죠,2023.11.4,0,youtube,0
환경부는 규제가 과한것 같다규제 하면 잘 한가고 생각하나 석기시대로 되돌릴려고 하나 정부가 국민의 편의도 생각 해야지산업적으로 피해받는 국민도 생각해야지환경단체에 끌려다니나 ㅇ럴거면 환경부 해체해라,2023.10.26,0,youtube,0
서민물가 다시한번 올려서 서민경제 힘들게하고 일제일회용품은 모든것에 우선하는 동맹의 가치라며 봐주기할거같은 굥의 가르침이겠지,2023.10.26,0,youtube,0
userwn4cc1bb2j독재자 왕인데 지금 서민경제 망쳐놓은 굥이면 지맘대로 뒤업을수 있잖냐 문재인때면 이따위로 경제 망칠리가없지,2023.11.4,0,youtube,0
userwn4cc1bb2j 후쿠시마오염수 제발 좀 뿌리게하자고 수백억들여 홍보영상 만들고 여론조작하던 그 정성 반의반만이라도 굥이 해봤어봐라 아 저놈이 규칙을 잘 따르는 놈이라 그런가보다했겠지 일본어민들은 위로해줘도 한국서민들은 알바없다는게 굥이다,2023.11.4,0,youtube,0
userwn4cc1bb2j 머저리야 굥은 본래 전임정부에서 이룬 성과 몽땅 지가 잘나서 그런다고 외국가서 발표하는 인간이다 그런 모지리 빨면서 퍽이나 잘난체다,2023.11.5,0,youtube,0
a hrefhttpswwwyoutubecomwatchvkSpgCX_6OhQampt1m43s143a 이 여자 헤어스타일이랑 말하는내용보소 끄덕끄덕그저,2023.10.26,0,youtube,0
대채품을 만들고 시행하던가 ㅡㅡ,2023.10.26,0,youtube,0
누가 만들어 놓은 법인가 깊이 생각합니다 인식과 현실사이,2023.10.26,62,youtube,0
문죄인이죠 플라스틱빨대비닐봉지규제했으니까,2023.11.8,0,youtube,0
컵에 가래침 뱉고 티슈나 쓰레기 넣는 사람도 꽤 많은데 그걸 대강 닦는다고 깨끗해질까 찝찝할것같은데,2023.10.26,4,youtube,0
이거 리얼 인정합니다 저 롯데리아 5년차 알바생입니다다회용 컵 포크 수저 칼 등등 사람들이 다회용인지 모르고 쓰레기통에 그냥 버립니다 매니저님들이 하도 없어지니까 알바생들한테 쓰레기통 하나하나 뒤지라고 그러셨고 하루에 n개가 쓰레기통에서 발견되네요 그 다회용품들 주워다가 1차로 설거지 하고 2차로 식기세척기 돌리지만 많이 찝찝합니다ㅋㅋㅋ 하루에 안버리는 사람이 없을 정도로 쓰레기통에 다양한걸 버리고용사람들이 그냥 챙겨나가서 공원에 버려져있는 경우도 많이 봤네요ㅎㅎ,2023.11.5,0,youtube,0
정치인들 ㅋㅋ 탁상행정ㅋㅋ 생각이란걸 안하는 놈들같네 ㅋㅋ,2023.10.26,1,youtube,0
장바구니나 들고다니면서 실천하자고하자,2023.10.26,0,youtube,0
종이컵은 사용하고 분리수거를 더 잘하는것이 현명하다 재활용 위생 환경을 위해  ㅡ세척시 수질오염 증가 및 일반인들은 잘 모르지만 컵을 세척행굼 많이 안하면 강한 세척린스 잇습니다,2023.10.26,1,youtube,0
식당 건들 시간에 대기업 제과 과대포장을 건드려야 되는거 아닌감,2023.10.26,0,youtube,0
진짜 미친듯이 써댔지 근대 과대포장부터 후드려 까야 하는거 아니냐,2023.10.26,1,youtube,0
이거이제 식당에서 물안주고 500미리생수 돈받고팔듯,2023.10.26,0,youtube,0
조만간 식당에서 컵도 안주거나 물도 사먹어야 겠네,2023.10.26,0,youtube,0
가게안에서 일회용품을 당연히 안써야지 뭐가 어려워 어렵기는 진짜 누가 보면 테이크 아웃 배달에 일회용품 못쓰게 하는 줄 알겠네,2023.10.26,1,youtube,0
그것도 조만간일거 같은데ㅋㅋㅋㅋㅋ,2023.10.28,3,youtube,0
왜 종이컵을 못 쓰게 하는 건지 이해가 안 된다그냥 종이컵 쓰게 해라,2023.10.26,0,youtube,0
환경을 지키는 자는 아무도 없다,2023.10.26,0,youtube,0
이게다국힘당때문이다,2023.10.26,0,youtube,0
환경관련법은 대부분 문재인때제정한거잘모르면서 정권탓만하는 무지성 ㄴㄴ,2023.10.30,1,youtube,0
윤병준 더불어민주당 의원 외 12인은 지난 6일 자원의 절약과 재활용촉진에 관한 법률 일부개정법률안을 공동 발의했다 이들은 기존의 일회용품 규제에서 더 나아가 불가피하게 사용되는 일회용품 재활용을 용이하게 이루어질 수 있도록 하고 생산단계부터 발생량을 줄이도록 할 필요가 있다며 법안 발의 이유를 밝혔다,2023.11.3,1,youtube,0
식기세척기 수요 폭증,2023.10.26,0,youtube,0
쓰레기 폐기물 처리가 지금 간당간당하다 환경때문에 저러는게 아니다,2023.10.26,1,youtube,0
중국에서 하지않는한 의미없는 짓거리 ㅋㅋㅋ,2023.10.26,1,youtube,0
ㅇㅈ,2023.10.26,1,youtube,0
걔들은 넓어서 쓰레기 묻을 땅 충분하고 우리나라는 없어서 그렇잖아요 줄이는게 답임,2023.10.29,2,youtube,0
elin4984  와 본인은 못느끼겠지만 그게 딱 속국 노예마인드임,2023.11.5,0,youtube,0
저런게 있었나,2023.10.26,0,youtube,0
과거에도 종이컵은 쓰지 않았다,2023.10.26,4,youtube,0
그니까요,2023.10.29,0,youtube,0
과거에는 스마트폰이나 유튜브도 없으니 삭제해라,2023.11.4,1,youtube,0
원래 자연상태에서 사피엔스의 평균수명은 36세였다하니 너도 딱 그정도까지만 살면 안되겠니,2023.11.5,0,youtube,0
그럼  커피도  배달못허겟네  일회용이니깐,2023.10.26,0,youtube,0
자기들 편리함만 쫒네그냥 이기주의 것들이다법시행하라환경오염 심하다,2023.10.26,0,youtube,0
식기세척기도 한계가 있고 설거지를 위해 직원을 한 명 더 뽑는다면 결국 비용은 온전히 소비자가 내겠지,2023.10.26,14,youtube,0
그럼니가 내든가모지리야,2023.11.4,1,youtube,0
당근,2023.11.6,0,youtube,0
머가 모지리 인디 맞는 말하는데 참나,2023.11.6,0,youtube,0
저런거 금지 왜 시킴저딴걸 시행한다고 지구가 건강해지겠냐 ㅅㅂ진짜 병신도 개병신 짓거리가 따로 없네 ㅋㅋㅋㅋㅋㅋㅋ 환경단체 니네들이 그냥 쳐 디지는게 환경에 도움된다선진국 다른 나라에서도 시행하지 않는걸 헬반도가 왜 하냐 ㅋㅋㅋ,2023.10.26,0,youtube,0
너무 한다  정부 정책 실패  우,2023.10.26,0,youtube,0
점포 규모 따라서,2023.10.26,0,youtube,0
지들이 준비 안한걸 왜 탓하노 그동안 준비도 안했으면서,2023.10.26,1,youtube,0
환경부터 건강 생각하면덜쓰는건 맞는데 ㅠ,2023.10.26,2,youtube,0
직원 구하기 넘 힘들고구해도  설겆이  인건비 늘어나는건  자영업자 부담  빨대 세척 할수있게 초음파 세척기라두  지원해주던가,2023.10.25,3,youtube,0
컵의 경우 물로 행구고 사용하면 된다는 인식이 강한데다내가 마시고 있는 이 컵이 누가 마셨는지 어떤 병에 걸렸을지도 모를 상황에이를 강제하기엔 코로나의 여파가 너무 큽니다,2023.10.25,36,youtube,0
모지리야ㅉㅉ,2023.11.4,0,youtube,0
만좃당이 입으로만 외치는,2023.11.5,0,youtube,0
맞아요과자의 과대포장도 규제해야 되고요,2023.11.14,0,youtube,0
립스틱 고추 가루만 안묻으면 그냥 물로 한번 행구고 손님한데 다시 주면 된다 너무 오바들 하시네,2023.10.25,0,youtube,0
미국중국유럽부터 제재해라지구환경을 한국 혼자 책임지냐,2023.10.25,1,youtube,0
딸배들 배달음식도 일회용품 못쓰게 해라,2023.10.25,0,youtube,0
편안함에 익숙해져있는데미래를 위해선 노력해야할 듯 싶고친환경적인 상품을 개발해주길,2023.10.25,21,youtube,0
생분해 플라스틱이 종류가 여러가지가 있어요 국내에서 제일 많이 쓰이는게 PLA인데 이건 자연생태계에서 분해가 잘 안되요 그래서 못쓰게 하는거예요,2023.10.26,0,youtube,0
Euryaleferox PBAT는 자연생태계에서 분해가 잘되는것으로 아는데 생분해플라스틱 PBAT 쪽을 활성화하는게 좋을것같아요 여러 해외 선진국에서는 PBAT 정부에서 나서서 힘실어준다던데요,2023.10.26,0,youtube,0
환경단체도 1회용 쓸거같다,2023.10.25,9,youtube,0
으원들아 너거 사무실가서 종이컵 있으믄 뒤진다,2023.10.25,7,youtube,0
그냥 텀블러하나 가방에 장바구니나 비닐봉지 접어서 넣고다니면 해결되는 문제 우산은 묶어 놓으면 물 안 떨어지고 우산 비닐 사장님은 아쉽지만 지금까지 사업 전환을 못 했다면 사라지는거지,2023.10.25,0,youtube,0
일부 동의 합니다 말씀대로 계몽을 통해서 대중소비자들 이 환경을 위해 본인의 불편함을 감수 하면서 십시일반해야 하는 문제입니다 만 현실은 몇몇 앞서나가신분들은 소수이신 반면 반대로 몸은 편하고 싶은데 환경문제다 보니 어어어 하고 머리로만 동의하면서 실생활에서는 편의를 따르시는 분들이 대다수 라는것입니다문제는 대중들이 내 편의를 버리고 싶어 하지 않는데 대중의 눈치를 봐야하는 업자에게 책임전가를 하는 제도인거 같습니다과속을 하는 소비자가 있는데 과속 딱지를 차 생산 업체에 부과 하는 꼴이랄까요제가 저 편하자고 쓰레기를 함부로 길에 버리면 저한테 과태료를 부과하지 길을 관리하는 지방자치단체에 책임을 묻지는 않을거 같습니다제도의 취지는 누구도 반대하지 않을거 같습니다 다만 그 정착과정의 현실적인 문제도 고려되었으면 좋겠네요,2023.10.30,0,youtube,0
ㅋㅋㅋㅋㅋ이제 종이컵대신 더 자연분해 오래걸리고 오염도 훨 더시키는 플라스틱컵이 훨씬 많이 쓰이겠네요 아주 잘하는 짓입니다  미세플라스틱 아메리카노 다들 맘껏 즐기십시오 ㅋㅋㅋㅋㅋ,2023.11.2,0,youtube,0
참으로 미친나라다  그럼 컵도 가지고 다니야겠다  썩은  정치인들  서로싸우지 말고  이런 거 좀  해라,2023.10.25,10,youtube,0
환경단체들 자기집에는 플라스틱없는지 확인해라 그 플라스틱은 누가 처리해주는데 대체없이 무조건 반대하는 답없는 것들에 휘듈리는 정뷰,2023.10.25,59,youtube,0
응 일회용품 규제 문재인이 한거임,2023.10.26,0,youtube,0
ㅋ 우리가금지해봐야 중국에서 우리가 1년쓰는 쓰레기 수백배배출한다,2023.10.25,6,youtube,0
그런 문제가 아닌데,2023.10.26,2,youtube,0
누구 실적 채워줄려고 이런 짓거리를 할까 궁금하다,2023.10.25,59,youtube,0
찾아보면 전부 더듬당,2023.10.31,5,youtube,0
정책만들어서 성과채우기위한 환경부직원들의 아이디어,2023.11.7,0,youtube,0
,2023.10.25,0,youtube,0
지금은 편한데미래를 봐서라도,2023.10.25,3,youtube,0
재앙강점기때 생긴 규제니 1찍 및 재앙이를 탓하세요,2023.10.25,1,youtube,0
우리라도 하는 거지 걔들 안 하면 우리도 안해야되,2023.10.25,4,youtube,0
중국하고 인도 미국이 나서야한다 ㅋㅋㅋ 우리나라는 도움안됨,2023.10.25,12,youtube,0
걔들은 땅덩이 넓어서 묻어버리면되고 우리나라는 쓰레기 처리할 땅덩이 포화 상태임 하나라도 줄이는게 답임,2023.10.29,2,youtube,0
걔네들은 땅이 넓어서 분리수거 자체를 안함 그냥 검은봉지에 음식이랑 같이 섞어서 버림 유독 우리나라만 심함,2023.10.29,2,youtube,0
userhj7ni2sr6x아무의미없으니까 하는말이지 내연차 멈추려먄 전기차개발해야지 내연차만 부셔버리면 해결됨 지능낮음,2023.10.30,1,youtube,0
위생상 종이컵이 날 것 같은데 ,2023.10.25,15,youtube,0
일회용품 금지해라 나아가 직원들을 일회용품처럼 쓰고 갖다버리는 기업들도 처벌하라,2023.10.25,3,youtube,0
저런거 금지 시킨다고 답이 나오냐,2023.10.25,96,youtube,0
니인생이나걱정해라 답이없다,2023.11.4,3,youtube,0
userxm5mc9gg8m니포함 븅신아 ㅋㅋ,2023.11.5,1,youtube,0
된장찌개 1만5천원 되는거지 뭐,2023.10.25,4,youtube,0
나라 꼴 지랄났네 진짜,2023.10.25,0,youtube,0
너무 좋아 ㅋㅋ,2023.11.13,0,youtube,0
ㅡㅡ 헷갈려 죽겠다,2023.11.9,0,youtube,0
종이빨대가 오히려 환경을 위협한다 잘했다 윤정부,2023.11.8,0,youtube,0
다시생각해도 종이빨대는 진짜 어떤 c발이 건의한건지 궁금하네,2023.11.8,0,youtube,0
스벅 빨대 좀 바꿔조라,2023.11.8,0,youtube,0
이랫다 저랫다 뭐꼬,2023.11.8,0,youtube,0
신호등도 모두 없애고 자기 가고 싶으면 그냥 가자,2023.11.8,0,youtube,0
여러분 이제 환경 생각하지 말고 다시 디젤차 탑시다,2023.11.8,0,youtube,0
아니 이러면 규제일 맞춰서 대체품 미리 구입한 영세 사업장들은 어케 할거 ,2023.11.8,1,youtube,0
알빠노,2023.11.13,0,youtube,0
산거니까 쓰겟지,2023.11.13,0,youtube,0
국개들이 법을 소꿉놀이 하듯 수시로 만들고 수시로 바꿈 이러니 국민들이 혼란이오지 그렇게 따라하고 싶은 외국들도 이렇게 자주 안바꿈,2023.11.7,7,youtube,0
표받자고 환경을 버리네 오히려 역효과나라,2023.11.7,1,youtube,0
종이빨대가 환경에 더 안좋다는건 하도 뉴스에 많이 나와서 너네 엄마도 알겠다 ㅋㅋㅋㅋㅋ 제발좀 아는척좀 하지마라,2023.11.7,5,youtube,0
종이빨대를 재활용 하기 위해서는 일반적인 순 종이나 프라스틱 빨대에 비해 공정이 하나 더 들어가야 합니다종이빨대에는 젖지 말라고 코팅을 하는데 이로 인해 재활용시 들어가는 공정이 추가되고 비용이 더 들어간다 하죠 프라스틱 빨대는 분리 수거를 확실히 하고 재활용만 잘 한다면 오히려 환경에 끼치는 영향을 최소화 시킬수 있습니다그간 그 분리수거가 안되고 있으니 문제였던거죠,2023.11.8,0,youtube,0
환경 어쩌구 애들 입에 종이 빨대 100개 한꺼번에 물리고싶다,2023.11.7,2,youtube,0
동의합니다,2023.11.9,1,youtube,0
