comment,date,num_likes,tag,sentiment_score
이랬다 저랬다 하지말고 그냥 텀블러 같은  지속적으로 사용할 용기를 이용할 경우 음료나 음식 할인해주는 폭넓은 정부지원 정책하면 좋을듯 어플등으로  개인용기포장  선택 같은거 넣어서 하면 운동도 되고 배달비 아끼고 탄소줄이고 할인 받고   ,2023.11.7,0,instagram,0
대충막쓰면서 살자 세상에 영원한건없다,2023.11.7,0,instagram,0
아니 적응해서 텀블러도 열심히 들고 다니고 했는데 뭘 또 안한다고 난리여  ,2023.11.7,0,instagram,0
아니 이제 좀 적응해가는데에   ,2023.11.7,0,instagram,0
,2023.11.7,0,instagram,0
미  정부   부끄럽다   종이 빨대 대신 친환경 빨대도 많던데,2023.11.7,0,instagram,0
스벅은 무슨 종이빨대에 꽂혀가지고    빨대때문에 안감,2023.11.7,0,instagram,0
지구인의 입장으론 친환경제품을 사용해야 하는건 맞다소상공인의 입장으론 부자재값이 너무 많이 든다구청직원들은 계도기간이 끝나간다고 준비하라 해서 준비 했더니 무기한 연기다뭐 어쩌란거지  지구인과 소상공인의 내적갈등과 외적요인이 너무 복잡스럽다,2023.11.7,0,instagram,0
아  ,2023.11.7,0,instagram,0
당분간 이꼴을 봐야 하다니  ,2023.11.7,0,instagram,0
이랬다가 저랬다가 왔다갔다 ,2023.11.7,0,instagram,0
그냥 뭐 나오면 저어서 줘   입대고 마실게   ,2023.11.7,0,instagram,0
표심얻을려고 별짓을 하는구나,2023.11.7,0,instagram,0
싸이가 부릅니다  이랬다가 저랬다가 왔다갔다   ,2023.11.7,0,instagram,0
     왜 또      하여간 멀쩡한것만 피해가는 것도 재능이다,2023.11.7,0,instagram,0
시대를 역행하는 정책      갈수록 엉망진창,2023.11.7,0,instagram,0
빈대부터 좀 어떻게 해줘요    ,2023.11.7,0,instagram,0
   누가 대한민국이 선진국이래   저리 역행의 발상을 하고 있는데 말이지   ,2023.11.7,0,instagram,0
앞날이  걱정안되나   당쟝 내일이라도 기후이상으로 죽을수도 있는데 먹고 사는걱정이 제대로 생각이 박힌거임 ,2023.11.7,0,instagram,0
또 표 때문이지   ,2023.11.7,0,instagram,0
  ,2023.11.7,0,instagram,0
정치권들 알력다툼 할때지 암만 ,2023.11.7,0,instagram,0
그냥 유지라도 하자 퇴보는 아니잖음    ,2023.11.7,0,instagram,0
그래 뭐 빨대 없애면 뭐해 플라스틱 뚜껑을 주는데       의미없는짓거리였지 모     친환경이니 그린마케팅이니 비건이니 뭐니 다 그저 좋은 사업수단이었지 뭐  ,2023.11.7,0,instagram,0
대환영,2023.11.7,0,instagram,0
하 누가 뽑았니 ,2023.11.7,0,instagram,0
규제해야지 맘에안들어 이정부 중말,2023.11.7,0,instagram,0
이번정부는 환경과 미래는 무시해도 된다고 생각하나봄,2023.11.7,0,instagram,0
  ,2023.11.7,0,instagram,0
후행의달인정부구나   진짜 하나에서 열까지 다 망쳐놓네   그간 노력은 뭐니 역대병신정부,2023.11.7,0,instagram,0
,2023.11.7,0,instagram,0
역시 환경파괴부     ,2023.11.7,0,instagram,0
물가 안정이나 잡아  일회용은 늘리고 퇴행,2023.11.7,0,instagram,0
관심은 오직 지들 밥그릇 뿐   ,2023.11.7,0,instagram,0
종이컵은 종이가 아님  우리 음식이 닿는 부분은 비닐 코팅  환경호르몬 오조오억게 드링킹 하는 거임  찬물에서도 나옴  일회용품은 그냥 환경호르몬 미세플라스틱에 버무려 먹는거고 우리 몸속에 떠다니다가 야금야금 건강이 나빠져도 일회용품은 계속 쓴다는  ,2023.11.7,0,instagram,0
제발 바닷가  산이나 국립공원에 일회용품 들고가지 마세요  일부러 버리지 않아도 바람에 날려 본의아니게 버려지게 됩니다  그거 뛰어가서 줍는 사람은 없죠  그렇게 뒹굴다가 야생동물이 먹서나 몸에 감깁니다     ,2023.11.7,0,instagram,0
이 정부는 이랬다 저랬다 언제 내려오려나,2023.11.7,0,instagram,0
지원금 돈은 계속 나가고 달라지는 건 없겠네요 ,2023.11.7,0,instagram,0
한동안은 뭐지  잘적응했는데  ,2023.11.7,0,instagram,0
뭐냐 증말  할말이 없네,2023.11.7,0,instagram,0
에효   ,2023.11.7,0,instagram,0
역행하는 정부      요즘 친환경    저탄소 겁나 외치면서 예산 책정한거 다 어디갔누    주식이며 경제며 환경이며 전부 나락가는 윤정부,2023.11.7,0,instagram,0
일본 아베형이 골판지 사업한다고 아베정부가 나서서 골판지를 그리 써대며 팔아주더니  회용품 회사들과의 커넥션이 있나 의심되는구만,2023.11.7,0,instagram,0
                                         ,2023.11.7,0,instagram,0
          난리다  ,2023.11.7,0,instagram,0
병싱같은 정책 철회,2023.11.7,0,instagram,0
왜 이러냐  줄리가 그러기 싫대 ,2023.11.7,0,instagram,0
해야할 건 왜 꼭  안하냐 ,2023.11.7,0,instagram,0
이게뭐하자는거지    이게나라냐   후진국으로만드는시람들   ,2023.11.7,0,instagram,0
한동안 안하는 것들이 많지 네들이  일을 뭐같이 하지 항상 ,2023.11.7,0,instagram,0
지금 세대가 미루면 미룰수록  후세대의 부채가 된다  ,2023.11.7,0,instagram,0
진짜 화가 나네요 하 ,2023.11.7,0,instagram,0
지랄을 해라,2023.11.7,0,instagram,0
마시고 간다는데도 일회용컵에 주는 대형카페 존 시름 딱봐도 지들 설거지하기 싫어서   만만한 스벅만 맨날 뚜드려맞지  ,2023.11.7,0,instagram,0
      ,2023.11.14,0,instagram,0
부들부들부들   ,2023.11.21,0,instagram,0
종이빨대도 어차피 재생 안된다며? 대체 누구를 위한 종이빨대인가?,2023.11.24,44,news,0
환경에 더 나쁘다는 연구는 어쩌고 ㅋ,2023.11.24,29,news,0
리짜이밍의 민주당이 정권 잡으면 보복할까봐 무서운 듯!! 그걸 떠나서 기업들이 스스로 한다면 말릴 필욘 전혀 없죠!,2023.11.24,26,news,0
"언제부터 고렇게 기후문제 환경문제 신경 썼냐? 태양광발전 한다고 산이란 산은 다 작살 내놓고 뭔 견소리.좌빠리들놈들 떠드는 소리가 되려 소음공해고,떠드냐고 튀는 니놈들 침 섞인,뱉어내는 더럽게 오염된 니놈들 말이 환경오염이다.",2023.11.18,11,news,0
재명이가 철학이나 원칙이 있어서 뭔가를 반대하는게 아니야... 얘는 잉여인간 토착 악플러 종자 그놈처럼 그냥 습관적으로 무조건 반대하는거야... 더러운 인간성이 둘다 50보 100보 잖아... 한심한것들...,2023.11.18,9,news,0
종이컵 빨대로 깔짝쑈 하지말고 신형 원자력 발전소 개발에 투자해라! 눈 앞에 코끼리 두고 개미 잡는다고 쑈 작작해라!,2023.11.18,8,news,0
이재명씨. 그래서 당신은 매일 일회용품이 가득한 샌드위치 세트와 초밥 등을 법카로 주문배달을 시켜 드셨군요. ㅋㅋㅋ,2023.11.18,6,news,0
아이고 ×× 꼴에 ~^ 재판이나 잘받아라 ~^ 요즘에는 샌드위치 어떻게 드시나 ?,2023.11.18,3,news,0
죄명이 놈은 제 문제도 해결하지 않은 상태서 뭔 이래라 저래라냐 입 닥치고 있어라.,2023.11.18,3,news,0
아무것도 모르시잖아요.. 방탄한다고 공부하나 안하고 정부가하면 반대.. 국힘당하면 반다.. 더만당 정책도 똑바로 몰라서 정책위장도 당황하게 만들고.. 공부 좀 하세요.. 제발.. 교도소에서 할려고 그러나... 참참참..,2023.11.18,3,news,0
낼모래 감옥직행할 전과4범이 괴변 ? 교도소안에서 그런소리해라 교도소동문들 이 어떻케 생각하는지물어보고 ...이번에들어가면 별이몇개냐 ?,2023.11.18,2,news,0
얜 뭐 알고나 하는소린가? 써준거나 씨부리지 말고 공부좀해라. 쇼하느나 공부할 시간이나 있을려나?,2023.11.18,2,news,0
조속히 이재명의 재판을 정상화 해야 한다.,2023.11.18,1,news,0
"말 신용이 없는 놈자 말 들을 가치도 없지만,무조건 반대만 해 대니 더 들을 필요도 없다.그냥 찌그러져 있다가 갈 데나 가그라.",2023.11.8,33,news,0
요즘도 일본산 샴푸 쓰나? 법카로 쓰시나? 아니면 누가 사주시나? 자기돈은 아까워서 1원 한푼 안쓸 것 같은데~,2023.11.8,28,news,0
니 꼴이나 관리 잘해라. 아무리 정부가 잘못해도.. 입이 백개라도 주딩이 닥치고 있어야 할 자가 어디 함부로 짖고 있나!,2023.11.8,27,news,0
"입만 열면 거짓말, 쌍소리, 내로남불. 저게 대통령이 못된게 얼마나 다행인지...",2023.11.8,13,news,0
웃기고 자빠졌네 세금으로 초밥이나 사먹는 주제에 무슨 기후변화 어쩌구 어울리지도 않는말을 지꺼리면 니 입이 부끄럽다고 하겠다,2023.11.8,12,news,0
"그렇게 나라를 사랑하는 자가 법카로 일본산 샴푸, 쇠고기,초밥 사서 쳐 바르고 처 먹는가?",2023.11.8,11,news,0
카페에서 일회용품 규제? 전형적인 장식용 규제다. 뭐 일회용품 제조사가 만들어 판매하는 양을 매년 조사라도 해보고 이야기 하던가. 별차이 없을거다. 양으로 따지면 빙산의 일각만 규제하는 거니까. 평소에 규제가 잘 먹히지도 않는다. 그러다가 일제단속에 걸린 업체만 과태료 물고. 풍기문란 단속이랑 비슷해.,2023.11.8,10,news,0
뭉가 일당이 5년동안 한 짓거리는 정상적인게 하나도 없어 이놈아 하다못해 종이 빨대업체도 패거리와 관련이 있는지도 모르고 나만 그런생각할까? 국민을 편하게 해야지 때되면 30만원 살포하고 결국 국민은 30만원 한두번 받고 평생 3000만원 도 넘게 갚아야 하는게 현실이쟎아,2023.11.8,3,news,0
"말 신용이 없는 놈자 말 들을 가치도 없지만,무조건 반대만 해 대니 더 들을 필요도 없다.그냥 찌그러져 있다가 갈 데나 가그라.",2023.11.8,3,news,0
요즘도 일본산 샴푸 쓰나? 법카로 쓰시나? 아니면 누가 사주시나? 자기돈은 아까워서 1원 한푼 안쓸 것 같은데~,2023.11.8,2,news,0
니 꼴이나 관리 잘해라. 아무리 정부가 잘못해도.. 입이 백개라도 주딩이 닥치고 있어야 할 자가 어디 함부로 짖고 있나!,2023.11.8,1,news,0
"입만 열면 거짓말, 쌍소리, 내로남불. 저게 대통령이 못된게 얼마나 다행인지...",2023.11.8,1,news,0
#인권#환경#시민#연대#정의----> 저 단어 내새우는 단체들은 믿고 거르면됨. 포퓰리즘의 창시자가 왜저러지?,2023.11.8,1,news,0
웃기고 자빠졌네 세금으로 초밥이나 사먹는 주제에 무슨 기후변화 어쩌구 어울리지도 않는말을 지꺼리면 니 입이 부끄럽다고 하겠다,2023.11.8,0,news,0
"그렇게 나라를 사랑하는 자가 법카로 일본산 샴푸, 쇠고기,초밥 사서 쳐 바르고 처 먹는가?",2023.11.8,0,news,0
카페에서 일회용품 규제? 전형적인 장식용 규제다. 뭐 일회용품 제조사가 만들어 판매하는 양을 매년 조사라도 해보고 이야기 하던가. 별차이 없을거다. 양으로 따지면 빙산의 일각만 규제하는 거니까. 평소에 규제가 잘 먹히지도 않는다. 그러다가 일제단속에 걸린 업체만 과태료 물고. 풍기문란 단속이랑 비슷해.,2023.11.8,0,news,0
"실생활과 연관된 것들중에 심각한 환경오염이 아닌 경우는 이것저것 붙여가며 태클 좀 걸지마라.정작 진짜 환경오염은 전국토에 널부러져 흉하게 자연 훼손시키고 있는 태양열 방열판인데,이에 대해서는 왜 한마디 안하냐?후손에게 물려줄 환경도 정치적으로 계산하냐? 앞으로 환경단체 심사 철저히 하여 엉터리 단체는 지원 중단해야 한다",2023.11.8,44,news,0
"환경시민단체...문어벙 때 탈원전 태양광사업을 하면서 엉청나게 환경파괴를 했는데...그 때는 말 한마디 못하다가...이제와서 일회용품 규제 철회를 비판하네! 참! 웃기는 사람들이다. 일반 시민들은 환경시민단체 헛소리를 들은척도 안하고, 코웃음 친다.",2023.11.8,23,news,0
"국내 '환경시민단체'에 속한 인간들아!! 너희들이 환경을 위해서 한 일이 무엇인가 잘 반성해 보기 바란다. 국민들을 괴롭히는게 환경사업이 아니다. 세치 혀만 살아서 주접을 떤 너희들 때문에 대한민국의 실질적인 환경은 후퇴했고, 국민들은 온갖 환경보호의 굴레에 가두어져 온갖 불편을 감수해야만 했다. 정부는 환경부를 중심으로 실질적인 환경보호가 이루어지도록 해야 할 것이며, 시민단체라는 명분 하에 온갖 이권에 개입해서 자신들의 이익만 챙기는데 혈안에 되어있는 소위 환경단체라는 놈들에 대한 조사를 강화해서 불법을 조금이라도 저지른 놈들은 다 구속시켜야 한다.",2023.11.8,10,news,0
이념따라 진실까지 왜곡하는 단체는 없느니만 못하다.,2023.11.8,8,news,0
"선택적 환경, 선택적 행동..... 그냥 환경단체, 시민단체라 하지 말고.....내편만 환경단체....'내환단'이라고 해라..... 사악한 종들의 집합체....",2023.11.8,8,news,0
우리나라는 되도않은 환경단체들이 나라를 갉아먹는 집단들이다 나라의 비전을 저해하는 악의축들이다,2023.11.8,7,news,0
"실생활과 연관된 것들중에 심각한 환경오염이 아닌 경우는 이것저것 붙여가며 태클 좀 걸지마라.정작 진짜 환경오염은 전국토에 널부러져 흉하게 자연 훼손시키고 있는 태양열 방열판인데,이에 대해서는 왜 한마디 안하냐?후손에게 물려줄 환경도 정치적으로 계산하냐? 앞으로 환경단체 심사 철저히 하여 엉터리 단체는 지원 중단해야 한다",2023.11.8,2,news,0
"환경시민단체...문어벙 때 탈원전 태양광사업을 하면서 엉청나게 환경파괴를 했는데...그 때는 말 한마디 못하다가...이제와서 일회용품 규제 철회를 비판하네! 참! 웃기는 사람들이다. 일반 시민들은 환경시민단체 헛소리를 들은척도 안하고, 코웃음 친다.",2023.11.8,1,news,0
"국내 '환경시민단체'에 속한 인간들아!! 너희들이 환경을 위해서 한 일이 무엇인가 잘 반성해 보기 바란다. 국민들을 괴롭히는게 환경사업이 아니다. 세치 혀만 살아서 주접을 떤 너희들 때문에 대한민국의 실질적인 환경은 후퇴했고, 국민들은 온갖 환경보호의 굴레에 가두어져 온갖 불편을 감수해야만 했다. 정부는 환경부를 중심으로 실질적인 환경보호가 이루어지도록 해야 할 것이며, 시민단체라는 명분 하에 온갖 이권에 개입해서 자신들의 이익만 챙기는데 혈안에 되어있는 소위 환경단체라는 놈들에 대한 조사를 강화해서 불법을 조금이라도 저지른 놈들은 다 구속시켜야 한다.",2023.11.8,1,news,0
이념따라 진실까지 왜곡하는 단체는 없느니만 못하다.,2023.11.8,0,news,0
"선택적 환경, 선택적 행동..... 그냥 환경단체, 시민단체라 하지 말고.....내편만 환경단체....'내환단'이라고 해라..... 사악한 종들의 집합체....",2023.11.8,0,news,0
우리나라는 되도않은 환경단체들이 나라를 갉아먹는 집단들이다 나라의 비전을 저해하는 악의축들이다,2023.11.8,0,news,0
종이빨대 생산할때 탄소배출 5.5배 // 쉽게분해 되지않아 환경오염 비슷하네 // 면밀한 조사검토후 도입여부 결정해,2023.11.8,105,news,0
"잘한 일이다. 규제는 기업의 발목을 잡을 뿐, 종이는 자연으로 보네면 되지",2023.11.8,67,news,0
환경만 생각하면 이번의조치가 역행하는 것일수도 있지만 그동안 많이 불편했고 업소등에서는 업주도 손님도 불편했고 불필요한 지출도 많았다.선거용이 아닌 부득이한 조치였다 생각한다.쓰레기없는 환경 이세상에 싫어할 사람이있나 너무 환경만 강조할것도 아닌것이 환경들먹인 폐해도 많았다.,2023.11.8,27,news,0
"조선일보 사설이랍시고 자기 이름은 숨긴채 뻘소리하는 인간은 누구인가? 멋대로 선거용으로 매도하면 되는가? 거창하게 ""환경"" 만 갖다 부치면 정의 인가? 태양광등이 실질적 환경에 도움되는 대안이 되지 못하여 원자력으로 돌아서는 세상에 이 사설의 주장은 OOO식 꽉 막힌 사고와 다를 바 무엇인가? 진정 환경에 대한 고민을 하는 자라면, 멋대로 총선용이라 매도 할 것이 아니라 불편만 초래하는 겉치레 환경보호 정책이 아니라, 360도 돌아보는 큰그림을 위해 재고하고자 하는 현 정부의 노력을 두손두발 다 들고 환영해도 모자랄 판에 왠 겉핥기식 헛소리냐",2023.11.8,20,news,0
"환경만 강조할 것도 아니다. 그동안 양산골개버린 뭉가놈 강점기 시절, 환경보호단체들 들먹인 폐해도 수없이 많았다. 후쿠시마 처리수 배출로 수산물 시장 교란. 새만금 잼버리 대회. 환경단체들 믿지못하는 것은 자업자득이다. 종이 빨대는 환경파괴 아닌가 ? 플라스틱보다 더 큰 환경파괴다... 텁텁한 맛이 느껴져 진짜 싫었는데...우리는 정부의 결정을 환영한다... 선거용이 아닌 부득이한 조치였다 생각한다. 간단하고 편리하게 사용되고 있는 일회용품을 금지해야 한다고 하는 조선일보의 사설내용이 오히려 견강부회격이다. 어제는 공매도의 역기능은 생각도 않고, 딴지걸더니...쯧쯧",2023.11.8,18,news,0
또다시 자연으로 돌아가자는 말인가? 일회용규제가 여론이 높다고? 여론은 늘 그렇게 나온다. 그러나 내가 대상이되면 정부는 죽일놈들이된다. 일회용품 사후관리나 똑바로들 해라. 다 쓰레기로 버리지말고. 그게 혁신이고 개혁이다. 현대문명에서 과학을 이용을 왜안하나?,2023.11.8,17,news,0
일회용 종이컵 사용 중지가 적응되어 가는데 갑자기 백지화라니....환경부 맞냐?? 인기와 선거를 의식하지 말아라....,2023.11.8,16,news,0
종이 빨대는 환경파괴 아닌가 ? 플라스틱보단 더 환경파괴다... 텁텁한 맛이 느켜져 진짜 싫었는데 구웃 환영 한다...,2023.11.8,11,news,0
옳다. 그러나 한표가 아쉽다. 선거는 지면 끝이다. 이기고 보자!,2023.11.8,11,news,0
사설에 공감한다. 지금 당장 불편하더라도 지켜야 할 것은 물러나면 안 된다. 정책의 퇴행보다 진보를 원한다,2023.11.8,8,news,0
환경파괴 요인이 마치 1회용 컴이 주범이라는 주장이네! 찢죄멍이 쓰는 일제삼푸는 환경보호용인가! 보다 근원적 처방도 제시하면서 이런 논리를 펴야지 이게 무슨 사설인가 쇠설인가!,2023.11.8,8,news,0
안하겠다는 것이 아닌데 뭘 그리 난리노 조선일보 논설. 타 국가도 언제까지 하겠다고 준비 중인데 우리도 그렇게 하면 되는 거지. 조선일보는 늘 민생 민생 떠들더니... 민생은 안챙기나?,2023.11.8,7,news,0
종이빨대 생산할때 탄소배출 5.5배 // 쉽게분해 되지않아 환경오염 비슷하네 // 면밀한 조사검토후 도입여부 결정해,2023.11.8,7,news,0
"잘한 일이다. 규제는 기업의 발목을 잡을 뿐, 종이는 자연으로 보네면 되지",2023.11.8,6,news,0
환경만 생각하면 이번의조치가 역행하는 것일수도 있지만 그동안 많이 불편했고 업소등에서는 업주도 손님도 불편했고 불필요한 지출도 많았다.선거용이 아닌 부득이한 조치였다 생각한다.쓰레기없는 환경 이세상에 싫어할 사람이있나 너무 환경만 강조할것도 아닌것이 환경들먹인 폐해도 많았다.,2023.11.8,4,news,0
"조선일보 사설이랍시고 자기 이름은 숨긴채 뻘소리하는 인간은 누구인가? 멋대로 선거용으로 매도하면 되는가? 거창하게 ""환경"" 만 갖다 부치면 정의 인가? 태양광등이 실질적 환경에 도움되는 대안이 되지 못하여 원자력으로 돌아서는 세상에 이 사설의 주장은 OOO식 꽉 막힌 사고와 다를 바 무엇인가? 진정 환경에 대한 고민을 하는 자라면, 멋대로 총선용이라 매도 할 것이 아니라 불편만 초래하는 겉치레 환경보호 정책이 아니라, 360도 돌아보는 큰그림을 위해 재고하고자 하는 현 정부의 노력을 두손두발 다 들고 환영해도 모자랄 판에 왠 겉핥기식 헛소리냐",2023.11.8,4,news,0
"환경만 강조할 것도 아니다. 그동안 양산골개버린 뭉가놈 강점기 시절, 환경보호단체들 들먹인 폐해도 수없이 많았다. 후쿠시마 처리수 배출로 수산물 시장 교란. 새만금 잼버리 대회. 환경단체들 믿지못하는 것은 자업자득이다. 종이 빨대는 환경파괴 아닌가 ? 플라스틱보다 더 큰 환경파괴다... 텁텁한 맛이 느껴져 진짜 싫었는데...우리는 정부의 결정을 환영한다... 선거용이 아닌 부득이한 조치였다 생각한다. 간단하고 편리하게 사용되고 있는 일회용품을 금지해야 한다고 하는 조선일보의 사설내용이 오히려 견강부회격이다. 어제는 공매도의 역기능은 생각도 않고, 딴지걸더니...쯧쯧",2023.11.8,3,news,0
또다시 자연으로 돌아가자는 말인가? 일회용규제가 여론이 높다고? 여론은 늘 그렇게 나온다. 그러나 내가 대상이되면 정부는 죽일놈들이된다. 일회용품 사후관리나 똑바로들 해라. 다 쓰레기로 버리지말고. 그게 혁신이고 개혁이다. 현대문명에서 과학을 이용을 왜안하나?,2023.11.8,2,news,0
일회용 종이컵 사용 중지가 적응되어 가는데 갑자기 백지화라니....환경부 맞냐?? 인기와 선거를 의식하지 말아라....,2023.11.8,2,news,0
종이 빨대는 환경파괴 아닌가 ? 플라스틱보단 더 환경파괴다... 텁텁한 맛이 느켜져 진짜 싫었는데 구웃 환영 한다...,2023.11.8,2,news,0
옳다. 그러나 한표가 아쉽다. 선거는 지면 끝이다. 이기고 보자!,2023.11.8,2,news,0
사설에 공감한다. 지금 당장 불편하더라도 지켜야 할 것은 물러나면 안 된다. 정책의 퇴행보다 진보를 원한다,2023.11.8,1,news,0
환경파괴 요인이 마치 1회용 컴이 주범이라는 주장이네! 찢죄멍이 쓰는 일제삼푸는 환경보호용인가! 보다 근원적 처방도 제시하면서 이런 논리를 펴야지 이게 무슨 사설인가 쇠설인가!,2023.11.8,1,news,0
안하겠다는 것이 아닌데 뭘 그리 난리노 조선일보 논설. 타 국가도 언제까지 하겠다고 준비 중인데 우리도 그렇게 하면 되는 거지. 조선일보는 늘 민생 민생 떠들더니... 민생은 안챙기나?,2023.11.8,1,news,0
환경부와 환경단체는 같은 운동권인가? 후쿠시마 오염수 배출로 수산물 시장 교란. 새만금 잼버리 대회. 환경부가 정신 차릴 때가 되었는데! 시간이 걸리는 일인데 손 놓고 있는 모습인지 아닌지 국민에게 이해되게 시스템 구축하는 일. 어쩌다 장관 인가?,2023.11.8,1,news,0
잘했다.,2023.11.8,1,news,0
우리나라처럼 분리수거 잘 하는 나라도 없다며 그럼 된거야... 어차피 다시 재활용해서 사용하면 되는건데 뭔 상관이냐고.,2023.11.8,37,news,0
"비닐류 안쓰기 위해, 종이류 제작용 벌목이 환경 파괴를 더 시킨다.",2023.11.8,21,news,0
되도않은 규제일색으로 국민에 군림하는 환경부부터 없애버려라,2023.11.8,17,news,0
정신나간 놈들. 환경부 공무원들에게 지구온난화 대비 세금 걷어라.,2023.11.8,1,news,0
"환경단체들이 문제다.실생활과 연관된 것들중에 심각한 환경오염이 아닌 경우는 이것저것 붙여가며 태클 좀 걸지마라.정작 진짜 환경오염은 전국토에 널부러져 흉하게 자연 훼손시키고 있는 태양열 방열판인데,이에 대해서는 왜 한마디 안하냐?후손에게 물려줄 환경도 정치적으로 계산하냐? 앞으로 환경단체 심사 철저히 하여 엉터리 단체는 지원 중단해야 한다",2023.11.7,547,news,0
좌파정부가 싸놓은 똥을 치우시느라 윤대통령님 너무 고생이 많으십니다. 하나하나 잘못된 일들이 제자리를 찾아가네요. 모든 국민들이 윤대통령님께 감사를 드립니다.,2023.11.7,111,news,0
사용자 입장에서 종이 빨대는 편의성이나 감성 측면에서 그렇게 상쾌하지 않았다. 사소하지만 자영업자들께 아주 조금이라도 도움이 되면 좋겠다.,2023.11.7,98,news,0
민주당정권에 사고친걸 수습한다고 고생많네요 현정부가;;; 진짜 종이빨때 줄때 화나던대 식감도 사라지고 진짜 잘한일이네요.,2023.11.7,98,news,0
정책후퇴라고 주장하는 환경팔이들이 카페 차려서 해보면 좋겠네요. 문재인도 환경 팔아먹다가 자기 카페에선 종이컵 쓰던데요.,2023.11.7,56,news,0
고집 버리고...국익과 국민만 생각 해라. 국민이 바라는 정치를 하면 된다.,2023.11.7,20,news,0
돈줘가며 만들어 놓은 pla 는 활용할 생각조차 안하고 어짜피 종이도 코팅은 실리콘에 플라스틱인데 종이 들어간다고 친환경 친환경 용비어천가 부르고 있는걸 보면 환경부가 얼마나 머저리 집단인지 알 수 있지.,2023.11.7,18,news,0
