comment,date,num_likes,tag,sentiment_score
공무원 ㅅㄱ들 진짜 생각없이 에휴 환경단체 역겨워서 그저 한쪽만보고 무지성 반대 단체 말만 듣고 정책하는게 참 에휴 나무 부족해서 온난화가속은 에휴 모순덩어리들,2023.10.28,1,youtube,-5
총선을 의식하는 듯 역행하는 정부의 모습에 속이 답답합니다  정부의 정책이 이렇게 손바닥 뒤집듯 뒤집어도 되는 것인지   참 안타깝네요   ,2023.11.7,1,instagram,-4
역행도 어이없지만 제대로 된 자료와 통계가 아닌 일부만을 위한 정책은 좋은 정책이라는 생각이 들지 않아요  무엇보다 나라의 주체는 국민이고 소상공인들 역시 국민이기에 우리의 일회용품 비사용이 결국 국민을 위한것임을 모르지 않을텐데요  탄소배출을 줄인다는 정책도 있는 것으로 아는데 규제를 안하면 탄소 배출은 어떻게 줄이나요  탁상행정 탁상행정 하지만 이러한 정책을 정하는 의원들은 책임감과 함께 국민을 위해 스스로 엄격한 잣대를 가지고  정책을 추진해야한다고 생각합니다 저는 스쿠버 다이빙을 하면서  그리고 제 후손과 현재 저의 좋은 사람들과 함께 깨끗하고 아름다우며 경이로운 자연을 지속적으로 보고싶어요 ,2023.11.14,6,instagram,-4
참  댓글들 가관이다 안좋아진 환경을 위해서라면 맛없어도 마실수있게해주는 종이빨대를 사용해야되는거고  바쁜 현대사회에도   초도 안걸리는 텀블러 사용하면되는건데 참   같은 인간이지만 인간은 없어져야마땅하다,2023.11.7,7,instagram,-4
역시 자영업자를 위하는 국민의힘 윤석열 정부라고 생각 대단하다 그래서 외국인 이모님 수천명을 한국에 오게 해서 음식점에 취업 시키려고 하고 조선소 인력이 부족하다고 외국 인력을 들여오고 말 그대로 외국인 노동자들의 수를 더 늘리겠다는 것이라고 생각하는데 대단한 국민의힘 윤석열 정부다 윤석열 정부 지지하는 인간들 중 많은 인간들이 불법체류자들 더럽게 비난하는데 그런데 외국인 노동자들이 불법체류자가 되는 것 아닌가 진짜로 이것들이 하는 행위는 앞뒤가 맞지가 않아 그래서 난 너희들이 싫어 어떻게 하면 환경을 위해 더 나은 것을 할지 추진해야 할 정부가 이따위짓이나 하고 있으니,2023.11.7,0,youtube,-4
진짜 ㅅㅂ 전형적인 탁상행정 ㅋㅋㅋㅋㅋㅋㅋ이새끼들은 생각이 없나아무리 대한민국에서 전국민이 일회용품을 안쓴다한들미국 중국이 분리수거 조차 안한다진짜 ㅅㅂ 생각을 조금만 하면 되는건데,2023.11.1,1,youtube,-4
미친다 참 이게다 윤석렬 때문이다,2023.10.31,0,youtube,-4
너무 선진국들 따르려고 아무런 대책도 없이 저렇게 내놓으면 참도 잘 하겠다 할꺼면 좀더 채계적이고 대책을 마련해줘야지 참,2023.10.30,0,youtube,-4
셧다운과 더불어 탁상행정의 전형적인 ㅄ짓임 기업이 재활용 가능한 재료만 써서 생산하게 만들면 되는데 그거 지적했다간 뇌물이나 접대 못받으니까 국민한테만 죄다 부담시킴 우리가 아무리 플라스틱 분리배출 해봐야 원료 문제로 재활용 안되는게 태반임 근데 지들 뒷돈 받겠다고 이딴 탁상행정 만듬 종이빨대가 플라스틱 빨대보다 환경오염을 야기한다는게 이미 결론난걸 아직도 참나,2023.10.26,0,youtube,-4
그냥 앞에 쓴 사람 침 묻은 컵 그냥 쓱 닦아 쓰고그냥 앞에 쓴 사람 침 묻은 수저 그냥 쓱 닦아 쓰고그냥 앞에 쓴 사람 거닦아 씻고 어쩌고 그냥 쓰면 문제없네뭐가 문제지 왜 그래 우린 한민족 18 가족들이잖아가족끼리 찌개도 한 숟가락으로 뭐 맛있게 처잡수시면서 뭔 위생 호들갑은이 논지가 뭐야 일회용품 사용 자제가 아니라 금지잖아근데 이건 시간이 많이 걸리는 시회적 문제 해결점이 필요한 얘기잖아 서로가 공감할 더 나은 공공위생과 개인안전을 위한 사회적 호응과 인정 그리고 공유의 목적그게 이루어져야 실행해도 될까 말까한 민감한 얘기에 이행하지 않으면 과태료 또는 벌금을 물린다그거 발안한 너 똑똑하다 아주 멋져 그런 넌 네 개인 텀블러 들고 다니냐 인증샷 하나 올려줘봐라맞아 일회용품 문제 참 많은 개선과 조율은 절실해 불필요한 낭비와 환경파괴가 제일 크고근데 웃긴 건 왜 꼭 이런 식으로 국민들에게 그 문제들을 몰아서 세금으로 어찌해라 책임을 전가하는 거야현실적으로 제대로 못 씻는다며 물리적 세척시간 때문에 손님들 몰리고 쌓이는 치울 것들 몰리는 시간엔그래 맞아 식당이면 그럴 수도 있지 근데 다른 커피숍이나 뭐 좀 덜한 곳은 충분히 감내되지 않나그런 테이크아웃 커피숍 니들 점심 처먹고 제일 많이 가져가고 제일 많이 아무데나 버리잖아 뭘 아니라 그래그럼 뭐가 문제지 그걸 해결시켜줘 봐 일회용품 문제 해결 싸게 제대로 이해할 수 있게일단 식당 니들 밥처먹는 깨꿋한 위생세척에 소용되는 물값 세제비 인건비 기타 일반관리비 등등모든 문제와 해결점 거기 더해 필요한 사회적 지원점까지 다 따져 판단해서 결론을 내렸냐 니들부터 고쳐봐계도도 중요하지만 그 계도의 구심점 현실적 법적 허용치도 완성하고 일회용 쓰지마라 공표하라고니들 폼 낸다고 테이크아웃한 커피들 그 니 인간성만큼 차지고 더러운 남은 잔유물 그래 쓰레기 치워는 봤냐일회용품 문제 참 많은 개선과 조율은 절실해 불필요한 낭비와 환경파괴가 제일 크고근데 그걸 탁상공론으로 니들끼리 뭐 법적 어쩐 조치 취하네 어쩌네 18 장난해그냥 앞에 먹었던 손님 남은 반찬도 쓱 뒤집어 되 담아 쓰면 아이고 이렇게나 많이 감사합니다그냥 옆에 먹었던 손님 남은 메뉴도 쓱 덤으로 좀 내어 주면 아이고 이런 아량까지 감개무량그거 고맙다 너 맛있다며 먹을 수 있어 이 더러운 개3끼들아 개냐 사람처럼 일 좀 해라,2023.10.25,0,youtube,-4
"네 
나라 참 뭣같이 돌아갑니다
공휴일주말에 어떻게 해서 휴무날 정할까 또 
시민들한테 뭐로 과태료 어떻게 받아낼까 고민 마시고 국개의원님들 개인차량 요일제 운행 적용하시고 대중교통이나 타시고 다닙십쇼",2023.11.2,2,youtube,-4
참 방법이  대안을 마련해주고 하지말라하든가 그냥 하지마 하면 과태료  누구 머리에서 나왔는지 참,2023.11.3,0,youtube,-4
대한민국이 전 세계에서 플라스틱 배출 순위 중 높은 순위를 차지하는 것으로 알고 있는데  플라스틱 사용은 물론 편하지만 지금도 충분히 대체할 수 있는 여러가지 물건들이 많음에도 불구하고 사용되는 것이 참 안타까웠고 미래를 생각하면 참 좋은 정책을 내놓은 것 같아요,2021.2.19,0,youtube,-4
개돼지들 참 어렵게도 산다 친환경 떠드는 단체들은 세금 좀먹이들의 여론전에 이용되고 플라스틱 안쓰면서 고생하고 ㅋㅋㅋ 차라리 대기업한테 환경문제 해결하라 그래라 개돼지들아,2021.2.18,0,youtube,-4
가식 댓글 ㅈㄴ 많넼ㅋㅋㅋㅋ 생각해봐 이 영상 보고 내일 너희들의 모습 에코백 텀블러 들고다닐거같아 여전히 플라스틱 잘 쓸걸 또 잘쓰고나서 이러한 영상 올라오면 가식 ㅈㄴ 떨고 ㅋㅋㅋㅋㅋㅋㅋㅋ,2021.2.18,0,youtube,-4
참 못난정부다세계가 기후변화로 더큰고통을 받고있는데 법까지 마련하고 추진중인 정책을 이런씩으로  멍청하게바꿔버린다는게  정부가 국민들을 얼마나 가볍게 생각하는지  참 어이없는 정부다이런씩으로 정책을뒤집어벌이면 국민들이 그래 잘했다라고 할것같은가이따위로 일을 하니 국민들이 윤씨를 신뢰를 할수가 없다모지리 정부란 말이 딱어울린다,2023.11.7,0,youtube,-4
길에 쓰레기 아무데나 버리는 꼬라지 보면 꼭 필요한 정책이라고 생각하긴하는데 환경오염이고 뭐고 신경 안쓰는 사람들도 많아서 이게 잘 될지 모르겠음,2023.11.2,0,instagram,-3
개념없는 정부조직 환경부 추가요   하나같이 통일성있게 개념 없어줘서 고맙네   불편함 감소 중요하지   근데 좀더 탁상행정이 아닌 신중한 정책을 시행했으면 원망이라도 안듣지  ,2023.11.7,2,instagram,-3
뭐하자는거야  이런다고 총선때 국짐당 너네 뽑아줄줄 아냐      ,2023.11.7,0,instagram,-3
"이재명 이자식......다른 이슈로 자기 이름이 언론에 안올라가니까........별 개솔이로 "" 나~살아있슈~"" 라고 떠드는듯.........."" 저놈 며칠 지나봐요. 주둥이에 프라스틱 빨대 물고 싸돌아다니다가 언론에 노출되면 분명히 이럴겨~~ 내가 프라스틱 빨대 사용이 포퓰리즘이라 했지...안쓴다고 했냐? "" 이럴거여~ 그리고 이재명 저놈은 포퓰리즘의 뜻도 모르고 단어를 사용하는 자라니까......",2023.11.8,55,news,-3
"이재명 이자식......다른 이슈로 자기 이름이 언론에 안올라가니까........별 개솔이로 "" 나~살아있슈~"" 라고 떠드는듯.........."" 저놈 며칠 지나봐요. 주둥이에 프라스틱 빨대 물고 싸돌아다니다가 언론에 노출되면 분명히 이럴겨~~ 내가 프라스틱 빨대 사용이 포퓰리즘이라 했지...안쓴다고 했냐? "" 이럴거여~ 그리고 이재명 저놈은 포퓰리즘의 뜻도 모르고 단어를 사용하는 자라니까......",2023.11.8,3,news,-3
"환경 보호 한답시고 비닐봉지, 종이컵 규제 같은 헛짓거리 하지말고, 차라리 10부제 5부제를 하고, 공장 폐수 대기오염 단속이나 잘 해",2023.11.8,2,news,-3
"환경 보호 한답시고 비닐봉지, 종이컵 규제 같은 헛짓거리 하지말고, 차라리 10부제 5부제를 하고, 공장 폐수 대기오염 단속이나 잘 해",2023.11.8,0,news,-3
누가만들었던 정책인건지 참 ㅋㅋ 보여주기식 친환경때문에 세금만 ㅈㄴ썼네 ㅋㅋ,2023.11.8,25,youtube,-3
탁상행정 그냥 하지말라고만 하면 어쩌라고,2023.11.4,0,youtube,-3
개인 종이컵 들고댕겨야겠다  꼴같지도 않은 법만들고 종이빨대는 무슨 100프로 종이인가 ㅈㄴ 거지같음 ㅡㅡ,2023.11.2,0,youtube,-3
탁상행정 끝판왕이네 ㅅㅣ발 ㅋㅋㅋ,2023.11.2,0,youtube,-3
미국 중국 인도 러시아 세계 대부분의 인구를 가진 큰 나라들은 지키지도 않아요 왜 대안도 없이 우리만 불편 해야함 환경부 일 이따위로 할거면 때려 치워라,2023.11.2,1,youtube,-3
1회용품 아예 사용 못하게 해야 합니다 여기 저기 쑤셔놓고 너무 버려서 주어담고 안에 내용물 버리고 분리수거 하느라 힘듭니다,2023.11.1,0,youtube,-3
무식한 정치인들프라스틱 빨대는 안돼고 종이빨대는 돼고 코팅해서 제활용도 못하는데 차라리 일회용품 제활용방안을 생각해내라그렇찮아도 죽지못해 버티는중인데자영업자 다 죽이지 말고,2023.10.31,0,youtube,-3
코끼리가 아무생각 없이 계속해서 똥 싸는 동안토끼가 환경 생각하며 똥 참는 꼴 ㅋㅋㅋㅋㅋ,2023.10.28,5,youtube,-3
빨대 없이 쳐 먹으면 된다는무논리 새끼들이 많네우선 그게 가능 하려면1컵의 뚜껑이 없이 테이크아웃 해야함2 양을 줄여서 테이크아웃 해야함매장에서 먹을시1립스틱침립밤틴트등 이물질이 없이 설거지 해야 함식당에선 가능하다 보고 음료 매장은 현실적으로 인건비 효율성 위생성이 떨어짐2 컵의 갯수 증가 수십 수백개의 컵 구매 필요행정처리가 너무 통으로 이뤄지는게 이상한 부분인데무논리로 안쓰면 된다 라고대댓달지 마세요,2023.10.26,0,youtube,-3
제발 헛짓거리 좀 하지 말자 우리가 100년을 아껴봐야 중국 인도가 1개월만에 다 말아먹고도 남는다저런 친환경 어쩌고 진짜 뻘짓이야,2023.10.26,0,youtube,-3
빨대고 종이컵이고 백날 규제하면 뭐하냐 중국 인도가 지구 다 오염시키는데 왜 이런 작은 나라에서 이호들갑인가싶다 결국 지구안에서 살꺼고 어차피 환경은 답없음 중국 인도 인구합이 지구 절반 가까이 되는데 진짜 실효성도 없는 환경규제 그만 좀 하자,2023.10.26,0,youtube,-3
우리가 아껴봐야 미국 중국 인도는 쓰레기 막 버린다 ㅋㅋ,2023.10.26,0,youtube,-3
나는 골프웨어가게 하는데 매장에 옷이 몇천개있다 그거다 개별로 비닐포장되어있는데 신상들어올때랑 손님한테 새옷까줄때 버리는 비닐들 진짜 어마어마함 매주 버리는 비닐이 빨때 이딴거에 비해 새발의 피인데 ㅋㅋ 그냥 눈에잘보이는 카페 음식점만 조지는것도 웃김ㅋㅋ인터넷쇼핑몰에서 파는 옷들도 다 비닐에 들어있잖아 전국 옷가게에서 버리는 비닐같은건 생각도 못하는거같네,2023.10.26,0,youtube,-3
플라스틱이나 종이컵만큼 재활용 잘되는게 없다이런 말도안되는 전정부 업적 패기하고 차라리 재활용 비율과 효율성을 끌어올릴 대책을 내놓아라,2023.10.26,1,youtube,-3
참 마음편하다 대안도 없이 그냥 쓰지말라 통보만 하면 국가에서 돈나오고꿀도 이런 꿀이 없네,2023.10.26,0,youtube,-3
미국 유럽 가서 쓰레기통 확인해봐라분리수거재활용 시스템 개선하고 폐기물 처리를 더 효율적으로 개선해야지 탁상행정으로 돈낭비 불편만 초래하네설거지 할때 물 세제 안쓰냐그건 공짜인가,2023.10.25,0,youtube,-3
usercd1ur3li1c 솔직히 탁상행정이죠  개선이 안된면 현재로는 법을어기거나 아니면 컵만식기세척기하는게 좋을듯하네요  정말답이없는 탁상행정  저러면  종이컵회사도 망하고 식당도 인건비가 늘어나고  가격도   올라갈텐데요,2023.10.26,1,youtube,-3
진짜 병신들이 병신 짓거리들 한다 에휴,2023.10.25,0,youtube,-3
왜 ㅅㅂ 종이 각종세제 생활용품도 쓰지말지 ㅋㅋ 국개의원 버러지같은새끼년들 탁상공론 개쩌네 진짜 언제부터 지들이 환경생각했다고,2023.10.25,0,youtube,-3
계도기간이 대비책 마련하라는 의미로 주는 유예기간인데 현장에서 여태 어떻게 해야 하냐고 할 정도면 에휴 이미 유예를 했는데 대책은 없이 또 유예 그리고 또 아무것도 안 할 테고,2023.10.25,8,youtube,-3
이렇게 일회용품 사용을 강력하게 규제해봤자 환경 보호에 얼마나 도움이 되겠나 일본은 방사능 오염수를 그냥 바다에 버리고 중국 미국 인도 동남아 등등 셀 수도 없이 많은 나라가 분리수거는 커녕 일회용품과 플라스틱 사용 넘쳐 난다 탄소배출량을 줄이는 게 목적이면 공장과 기업을 조지던지 소상공인 조져서 언 발에 오줌 누기 밖에 더 하냐최소 10년 전부터 전세계가 합심해서 일회용품 규제에 나섰다면 나도 찬성하겠지만 지금은 소 잃은 외양간 고치는 모양새 밖에 안된다 국민들 조금이라도 좀 편하게 살게 냅둬라 분리수거와 재활용에만 좀 더 투자하고 신경쓰면 지구에서 제일 청결한 나라가 대한민국이다,2023.10.25,40,youtube,-3
국개위원들 진짜 내가 정치 하는 게 더 빠르겠다늙은이들아 그만 거기서 내려와 제발 탁상행정 언제까지 할 생각이냐 돈에 눈만 멀어서 tlqkf,2023.10.25,0,youtube,-3
계도기간을 줬으면 그 기간동안 준비를해서 대비를 해라 좀꼭 ㅅㅂ 계도기간 끝나갈때 발등에 불떨어지면 그때서야 허둥지둥 대책마련에 발동동 구른다느니 계도기간을 더 늘려달라느니 어렵다고 하소연 하는데  ㅅㅂ 그러니까 준비하라고 계도기간준거 아닌가뭔ㅅㅂ 기업들이고 자영업자들이고 사장들은 하나같이 계도기간을 주면 지킬 생각들을 안하냐법정근로시간 주52시간 시행도 계도기간을 줬는데도 대기업을 제외한 기업들은 계도기간 끝나가니까 어렵다느니 하소연해대고 지랄들을 하는데ㅅㅂ 돈쓰기 아깝고 설비늘리는게 아까우니까 안쓰고 인건비로 쓰는게 아까우니까 52시간 안지키는거지뭔 ㅅㅂ 계도기간을 주면 지켜라 이 시바것들아,2023.10.23,0,youtube,-3
userji2yd2zx7l기업이요 개개인에게 환경문제 해결하라고 드리대봤자 시민들 삶만 불편해지고 세금만 뜯어가지 기업이 계속 재활용도 안되는 물품 만들어대면 근본적인 해결이 안됨 특히 어업에서 버려지는 그물들이나 쓰레기들이 환경의 가장 큰 문제인데 그렇게 본격적이고 확실하게 환경을 지키고 싶다면 이에대한 해결을 더 적극적으로 나서야하는거 아님 솔직히 환경문제에 대한 다큐나 환경연구자들 얘기 좀만 관심있게 찾아봤다면 이번정책은 환경문제를 진지하게 생각 한건 아닌거 같고 걍  세금만 더 뜯어갈려는 정책 그 이상 이하도 아니라고봄 게다가 일처리 조차 제대로 못하고 있어서 시민들 혼란스럽게 만드는거 보셈 제대로 생활조사나 대처안도 없이 막 펼치는 정책의 특징임  차라리 진짜로 환경 생각하고 현실적으로 도움 될만한 거라면 친환경 제품을 발명할 수 있도록 연구비 지원이나 하는게 좀 더 효과적이지 않을까 싶음,2023.11.7,0,youtube,-3
일회용품 사용 못하게 하는 거 이것도 국개의원들이 정한 건가대기업은 놔두고 자영업자들만 건드리는 건가대기업에서 나오는 플라스틱이 진짜 많을 거 같은데,2023.11.4,0,youtube,-3
1 인건비 더 쓴다고 500원씩 더 올림2 컵 세척한다고 깨끗한가 아님 3 립스틱 ㅈㄴ 안닦임 친환경 재질 개많은데 일회용품을 규제하냐생분해 비닐도 많고 그런걸로 사게 돌려야지 규제한다고 된다냐,2023.10.25,1,youtube,-3
응 싫어 보증금 우리가 왜줘 커피숍에서 내야지 참 어이가 없네 어차피 저 ㅈㄹ해도 쓸놈은 쓴다,2022.1.19,0,youtube,-3
진짜 경험하지 못한 나라를 만드셨다  K재활용 K환경개선 이 ㅈㄹ하면서 국뽕팔이 하겠지 ㅅㅂ,2021.2.28,0,youtube,-3
솔직히 사회적 풍파 계산도 안하고 바꾸는게 탁상행정의 한계같음 특히 무조건 금지 돈 더내 하는건 세금 뜯고싶어서 환장난 사람들 같음 ㅋㅋㅋ 애초에 다른 음료들은 어떻게 마시라는거임 무작정 금지 하면 모든게 해결됌 ㅋㅋㅋ 곧 에코백도 사재기 막는 법안 만들 듯 ㅋㅋㅋㅋ 1인당 1개 사용 신고제 도입 ㅋㅋㅋㅋ 현 정부 클라스,2021.2.18,0,youtube,-3
한국이 백날 아껴봐야 중국이 다 오염시키는데 헛짓하느라 참 애쓴다 ㅋ,2021.2.18,0,youtube,-3
빨대없어지는건 솔직히 노답 스벅갈때마다 빡치는게 종이빨대때문인데 그래서 부러 스벅안가고 다른카페 가는건데 휘핑도 안돼 빨대도 안돼 컵도 안돼 카페는 왜 다 안돼 저럴거면 카페에서 테이크아웃할 이유 없지 않아 차라리 편의점에서 음료수 사마시지,2021.2.18,7,youtube,-3
총선에 나라의 미래를 팔아 먹는구나 에휴,2023.11.7,3,youtube,-3
매번 생각없이... 대책없이  싸지르는건 세계 1위지  정작  책임지는것들도 없는게  킬포인트,2023.11.9,35,instagram,-2
탄핵이 시급하다 진짜,2023.11.9,0,instagram,-2
총선용,2023.11.9,1,instagram,-2
차라리 친환경제품 지원을 해줘라,2023.11.9,0,instagram,-2
차라리 생분해 플라스틱을 쓰는게 낫지않나,2023.11.9,0,instagram,-2
노근본 탁상행정 종이빨대되고 종이컵안되는,2023.11.9,0,instagram,-2
차라리 텀블러 들고 다니라 그래 본인이 먹고 싶으면 하나씩 들고 다니겠지,2023.11.16,0,instagram,-2
이제 총선지나면 슬그머니 다시 얘기꺼낼거다알아..,2023.11.9,2,instagram,-2
에휴 진작에하던가ㅋ 이제와서 지키겠냐?ㅋ말이되는소리좀해 정부야,2023.11.2,34,instagram,-2
차라리 테이크아웃잔을 사라진다고딱 말하든가.,2023.11.2,0,instagram,-2
중국 미국 러시아 인구 터지는 것들은 1도 실천 안하는데 코딱지만한 우리나라만 제일 지랄 실질적인 해결책을 내야지 카페 다 망하라고 고사를 지내는군,2023.11.2,0,instagram,-2
프랜차이즈나 직원을 여러명 두고 크게 분식집을 운영하지 않는 사람들외에는 열악한 환경인데 .....한숨만 가득 나오는 탁상행정이 눈에 보인다 ,2023.10.26,101,instagram,-2
이쯤되면 총선에 미친 탐욕스런 돼지 정부라고 밖에 볼 수 없는데요  ,2023.11.7,1,instagram,-2
참  답답하네요,2023.11.7,1,instagram,-2
참 단편적으로 정책 오락가락 변경하는거 보면   고위공무원 분들 탁상공론이 얼마나 무서운 효과를 내는지 모르는거 같네요,2023.11.7,21,instagram,-2
총선 끝나면 원래대로 돌아옵니다  시간이 걸리겠지만 야권    석 때려박죠 ,2023.11.7,0,instagram,-2
안타깝긴한데    무책임한 정부도    탓할 수도 없는 노릇이네요  가짜 친환경에 기술적   한계를 넘어서지 못한     참 사업이란 어려운것 같습니다  힘내세요,2023.11.7,0,instagram,-2
아이고     규제철회로 전직원 퇴사처리면 종이빨대 제조 회사는 참 심각할수 밖에 없겠네요,2023.11.7,0,instagram,-2
곰곰히 생각해보니까 좀 이상하네       아니 많이 이상하네 플라스틱컵에 종이빨대로 먹고 있었어 뭔가 너무 언반란스하지 않아   부피적으로 보면 차라리 종이컵에 플라스틱 빨대를 사용하는게 맞지 ,2023.11.7,0,instagram,-2
이랬다가 저랬다가   아 총선이 다가오는구나,2023.11.7,259,instagram,-2
참 나  웃기는 짜장이네 진짜 뭐 이런나라가 다있음   ,2023.11.7,0,instagram,-2
진짜 뭐하세요            와 나 진짜 제발좀 내려와라          아 답답해          역행하는 정부 꼴도 보기 싫어  모든 현안에 대해 본질을 일도 모르는 정부      ,2023.11.7,0,instagram,-2
재명이는 말을 좀 품위있게하면안돼나 ? 더불어당이하는짓은 못믿어요 마약관계 예산 깍아없앤다는말 듣고 마약천국만들려그러나 어이없네 마약하고 연계돼어있나 이해안가는 집단이네,2023.11.8,10,news,-2
재명이는 말을 좀 품위있게하면안돼나 ? 더불어당이하는짓은 못믿어요 마약관계 예산 깍아없앤다는말 듣고 마약천국만들려그러나 어이없네 마약하고 연계돼어있나 이해안가는 집단이네,2023.11.8,55,news,-2
총선용 정책 후퇴 맞지. 윤희숙 씨 말대로 구분해서 시행하는 노력이라도 했어야 함. 비판받아 마땅함.,2023.11.8,4,news,-2
총선용 정책 후퇴 맞지. 윤희숙 씨 말대로 구분해서 시행하는 노력이라도 했어야 함. 비판받아 마땅함.,2023.11.8,0,news,-2
마트에서 1회용 비닐 봉지 대신 두꺼운 다회용 비닐 봉지를 쓰는 미국. 대부분의 사람들이 봉지 안 가지고 오고 새 비닐 봉지에 구매한 물건들을 가져가기 때문에 결국 몇배 더 많은 오염을 일으키고 있다. 탁상행정의 결과이다.,2023.11.8,6,news,-2
전정부 탁상행정의 결과물이죠 뭐,2023.11.7,0,youtube,-2
이제 원가 절감을 해야지그리고 빨대가 없으면 못 마시는게 아니잖아빨대 없이 그냥 먹는 문화를 만들 생각을 해야지계속 뭘 만들 생각만 하고 쓸 생각만 해드라마나 영화나 이쁘고 잘 생긴 배우들이 우선 빨대 없이 마시는 모습 자주 보여줘거의 대부분의 식 문화는 보고 배운다,2023.11.7,14,youtube,-2
종이빨대는 정말 시급하게 세상에서 사라져야함 차라리 빨대 필요없는 뚜껑 그게 더 맘에들더라,2023.11.8,2,youtube,-2
총선 앞두고 이랬다 저랬다한표 얻고자 지랄헌다,2023.11.7,4,youtube,-2
아직도 코로나 하루 3만명인데식당에서 종이컵 못쓰게 한다고 차라리 생분해 되는 종이컵 개발에 좀더 지원을 해주던가 해야지 누가 입데어 마시던 컵을 쓰냐 그리고 누가 씻어라고 하는 꼬라지들하곤,2023.11.7,0,youtube,-2
국민이 ㅈㄴ 불편해지는건데 이건 세계에서 몇번째로 하는거임  이렇게 큰 벌금 제도말야꼭 불편해지는 희생만 누구보다 앞장서는건 아니겠지,2023.11.4,0,youtube,-2
종이 빨대 전형적인 탁상행정의 예시임   실제론   플라스틱 빨대 보다 이산화탄소 34배 더 생성된다   종이빨대 업체랑 커넥션 있엇는지 조사해야할 판임,2023.11.4,0,youtube,-2
환경친화적인 제품부터 만드는게 우선이지 규제하고 과태료만 물리면 다네 전형적인 탁상행정,2023.11.4,0,youtube,-2
편의점에서 막사면  다어떻게들고가는지 참,2023.11.4,0,youtube,-2
탁상행정의 폐해,2023.11.3,0,youtube,-2
